Record ID,First Name,Last Name,DATE,MBI NUMBER,CLOSER,ENROLLER,CARRIER,FULL PLAN NAME & CODE,SEP,Mobile Phone Number,Date of birth,Street Address,City,STATE,Postal Code,LANGUAGE,STATUS,Status,LEAD SOURCE
1.41674E+11,Amelia,Moreno,6/10/2025,7Q85AY3DV73,JON GONZALES,JON GONZALES,UNITED HEALTHCARE,AARP Medicare Advantage from UHC TX-0011 (HMO-POS) H4527-001-000,DST,3617286026,11/20/1946,218 brown lane,Mathis,TX,78368,ENGLISH,Active,,MM SPANISH 4
1.41619E+11,JUDITH,TIENDA LUNA,6/10/2025,7YM9M31CA10,NATHALY COGLE,NATHALY COGLE,AETNA,Aetna Medicare Dual Preferred (HMO D-SNP) H4523-028-000,MOV,9564085113,12/28/1956,910 S Sugar Rd 1201,Edinburg,TX,78538,SPANISH,Active,,MM SPANISH 4
1.41549E+11,Timotea,Garza,6/10/2025,3PG7KA9WF57,JON GONZALES,JON GONZALES,HUMANA,HumanaChoice Giveback H5216-371 (PPO) H5216-371-000,DST,6233862998,8/20/1949,607 E MAHONEY AVE,Buckeye,AZ,85326,ENGLISH,Active,,MM SPANISH 4
1.41549E+11,Pamela,Hayes,6/10/2025,8HY7GU8AF32,BETHANY RAMIREZ,BETHANY RAMIREZ,HUMANA,Humana Gold Plus SNP-DE H8908-007 (HMO D-SNP) H8908-007-000,MCD,8102769274,5/27/1964,2125 FARLEY ST,PORT HURON,MI,48060,ENGLISH,Active,,PX JUNE 1 of 5
1.41549E+11,Howard,Waites,6/10/2025,4YD1HN2PD93,ASHLEY FRAZIER,ASHLEY FRAZIER,HUMANA,Humana Dual Select H5619-093 (HMO D-SNP) H5619-093-000,MCD,2568891002,10/4/1983,5731 Stockdale rd,TALLADEGA,AL,35160,ENGLISH,Active,,PX JUNE 3 of 5
1.41524E+11,LUKE,POULOS,6/10/2025,4XK5W14QH63,SABRINA GONZALES,SABRINA GONZALES,UNITED HEALTHCARE,AARP Medicare Advantage from UHC MO-0003 (HMO-POS),MOV,8703126691,2/22/1994,506 N Walnut Ave lot 17,Versailles,MO,65084,ENGLISH,Active,,
1.41548E+11,Alicia,Mitchell,6/10/2025,6Y55XN9EP55,CRISTINA RODRIGUEZ,CRISTINA RODRIGUEZ,HUMANA,Humana Dual Select H1951-056 (HMO D-SNP) H1951-056-000,MCD,9852481586,5/24/1967,230 s oak st,gramercy,LA,70052,ENGLISH,Active,,MOXXIEU65
1.41521E+11,Corey,Irvine,6/10/2025,3JK5GC6PY75,ADAM RODRIGUES,ADAM RODRIGUES,UNITED HEALTHCARE,AARP Medicare Advantage from UHC NY-0006 (HMO-POS) H3379-039,DST,6072819414,3/15/1973,PO BOX 66,Troupsburg,NY,14885,ENGLISH,Active,,MOXXIEU65
1.4155E+11,Cynthia,ladomirak,6/10/2025,8Y97K99TK46,ADRIANA ARROYAVE,ADRIANA ARROYAVE,HUMANA,Humana Gold Plus SNP-DE H6622-078 (HMO D-SNP) H6622-078-001,IEP,5704892791,11/29/1972,1132 MAIN ST APT A,PECKVILLE,PA,18452,ENGLISH,Active,,MOXXIEU65
1.41491E+11,JOHNNY,LAWRENCE,6/10/2025,3AK0QQ3MH23,LOUIS MARQUEZ,LOUIS MARQUEZ,UNITED HEALTHCARE,UHC Dual Complete AL-D001 (HMO-POS D-SNP) H0432-009-000,MCD,3346210925,1/8/1947,200 HIGHWAY 30,EUFAULA,AL,36027,ENGLISH,Active,,PX Upload May 2025
1.41468E+11,SARAH,MILLER,6/10/2025,1K59V99WX12,RAQUEL MCCRAY,RAQUEL MCCRAY,HUMANA,HumanaChoice SNP-DE H5216-388 (PPO D-SNP),MCD,5179202315,9/14/1963,130 CHESTNUT ST,ADRIAN,MI,49221,ENGLISH,Active,,MOXXIEU65
1.41363E+11,ELLEN,BURFORD,6/10/2025,2FV3N54DJ01,MARIA PIANTANIDA,MARIA PIANTANIDA,HUMANA,HumanaChoice - Diabetes and Heart (PPO C-SNP) H5216-334-000,DST,6622922716,7/30/1944,486 HIGHWAY 305 N,SENATOBIA,MS,38668,ENGLISH,Active,,PX JUNE
1.41474E+11,Diana,BING,6/10/2025,9VK4J32FT61,STEVEN TORRES,SARAH SANZ,UNITED HEALTHCARE,UHC Dual Complete GA-D002 (HMO-POS D-SNP),DST,9126574123,4/24/1953,PO BOX 1095,PEMBROKE,GA,31320,ENGLISH,Active,,PX JUNE
1.41408E+11,Paul,Krueger,6/10/2025,8PY1AG9PR91,TAYLOR DUNCAN,TAYLOR DUNCAN,HUMANA,Humana Full Access Giveback H5216-306 (PPO),DST,9067534341,3/28/1954,N10390 COUNTY ROAD 577,Daggett,MI,49821,ENGLISH,Active,,MOXXIEO65
1.41447E+11,SELETA,LISTER,6/10/2025,7CA6TJ2AJ85,ELIJAH CEBALLOS,ELIJAH CEBALLOS,UNITED HEALTHCARE,UHC Dual Complete TX-D007 (HMO-POS D-SNP) H5322-025-000,MCD,9039179181,3/28/1961,717 S Green St apt 4 202,Longview,TX,75602,ENGLISH,Active,,MOXXIEU65
1.41387E+11,Marye,Martin,6/10/2025,3G38AX8HT36,JON GONZALES,JON GONZALES,UNITED HEALTHCARE,UHC Dual Complete AL-Y1 (HMO-POS D-SNP) H2802-064-000,MCD,2563934392,8/10/1956,83 Rains Ct apt 14,Collinsville,AL,35961,ENGLISH,Active,,MOXXIEO65
1.41415E+11,QUEENIE,BARNHILL,6/10/2025,5DV7H38JK53,ASHLEY FRAZIER,PHIL COOK,UNITED HEALTHCARE,UHC Dual Complete NY-S001 (PPO D-SNP) H2001-063,MCD,3476778853,1/28/1960,"2475 BROOKSHIRE DR,  APT 73 BLDG 9",SCHENECTADY,NY,12309,ENGLISH,Active,,NOT FOUND
1.41426E+11,MARCELLA A,WILSON,6/10/2025,2R11E99FV96,PAOLA ALMANAZAR,KIMBERLY BUCHANAN,ZING,Zing Select Diabetes & Heart IN (HMO C-SNP) H4624-011-000,CSNP,3177404412,5/30/1957,6016 DICKSON RD APT 1,INDIANAPOLIS,IN,46226,ENGLISH,Active,,MOXXIEO65
1.41389E+11,KIMBERLY,BAILEY,6/10/2025,9GG5KG9MG99,ARTEMISA CARVALHO,LOUIS MARQUEZ,UNITED HEALTHCARE,UHC Dual Complete NY-S4 (HMO-POS D-SNP) H3387-017-000,MCD,5189323490,10/6/1965,106 OAK ST,HUDSON FALLS,NY,12839,ENGLISH,Active,,MOXXIEU65
1.41391E+11,edna,williams,6/10/2025,5QH0X83NV11,RAQUEL MCCRAY,YARISSA FERNANDEZ,CIGNA,Cigna Preferred Savings Medicare (HMO) H5410-052-000,DST,3055490048,7/15/1959,20206 NW 28th Ct,"Miami Gardens, MIAMI-DADE,",FL,33056,ENGLISH,Active,,MOXXIEO65
1.41374E+11,john,haddix,6/10/2025,7VE5RE0VQ54,LAUREN WILLIAMS,LAUREN WILLIAMS,HUMANA,Humana Gold Plus h4461-025 (HMO),IEP,9012058569,3/17/1960,4459 cedar glenn dr apt 4,memphis,TN,38128,ENGLISH,Active,,MOXXIEU65
1.41379E+11,Ronald,Ingram,6/10/2025,8MD0EC3TA41,ANDRE AMORIM,ANDRE AMORIM,HUMANA,HumanaChoice Florida SNP-DE H5216-394 (PPO D-SNP) LZ1F29D3VR,DST,9048056472,1/30/1952,5077 J Turner Butler Blvd,Jacksonville,FL,32216,ENGLISH,Active,,
1.41366E+11,ROBIN,MIESEN,6/10/2025,6AP2UY2CG15,ELIJAH CEBALLOS,ELIJAH CEBALLOS,UNITED HEALTHCARE,AARP Medicare Advantage Giveback from UHC TX-39 (HMO-POS) H0609-066-000,DST,4696854395,9/10/1957,7301 ALMA DR APT 522,PLANO,TX,75025,ENGLISH,Active,,MOXXIEO65
1.4136E+11,susan,ballard,6/10/2025,7cq7h54ww50,JACLYN LAVERY,JACLYN LAVERY,HUMANA,Humana Gold Plus Giveback H5619-169 (HMO),DST,8642902189,2/19/1960,700 redland road,spartanburg,SC,29354,ENGLISH,Active,,MOXXIEO65
1.41277E+11,WEDAD,KASHAM,6/10/2025,4FG7U95YT38,TERENCE PHILLIPS,TERENCE PHILLIPS,HUMANA,Humana Gold Plus SNP-DE H8908-005 (HMO D-SNP) H8908-005-000,IEP,7346359645,8/18/1960,"3670 BEECH DR, YPSILANTI",Ypsilanti,MI,48196,ENGLISH,Active,,MOXXIEU65
1.4136E+11,SYLVIA,BARGAS,6/10/2025,5M70VM6RT29,WENDY CORONA,WENDY CORONA,WELLPOINT,Wellpoint Full Dual Advantage (HMO D-SNP),OEP-N,8325334243,5/17/1960,4810 ENGLE RD,EAST BERNARD,TX,77435,ENGLISH,Active,,MOXXIEO65
1.41277E+11,matthew j,miller,6/10/2025,4DP1CN1KG95,YARISSA FERNANDEZ,YARISSA FERNANDEZ,HUMANA,Humana Full Access Giveback H5216-306 (PPO) H5216-306-000,MOV,5178618873,3/4/1959,"227 E Legrand St,","Howell, Livingston County",MI,48843,ENGLISH,Active,,MOXXIEO65
1.41351E+11,Mark,Villarreal,6/10/2025,6NT6FA4GN63,ADAM RODRIGUES,ADAM RODRIGUES,UNITED HEALTHCARE,UHC Dual Complete OH-S2 (HMO-POS D-SNP) H1285-001,LTC,2162628181,9/1/1955,5801 Huss Ave,Cleveland,OH,44103,ENGLISH,Active,,MM SPANISH 3
1.40789E+11,REGINA,LORA,6/9/2025,8YN6NT8NY40,TERENCE PHILLIPS,TERENCE PHILLIPS,ANTHEM,Anthem Dual Advantage (HMO D-SNP) H4471-003-000,DST,6612048597,8/28/1959,1009 FAIRFAX RD,BAKERSFIELD,CA,93306,ENGLISH,Active,,MOXXIEO65
1.40684E+11,RONALD,WORF,6/9/2025,1A50U54RD36,ELIJAH CEBALLOS,ELIJAH CEBALLOS,HUMANA,HumanaChoice Giveback H5216-430 (PPO) H5216-430-000,SNP,4357601458,6/7/1952,55 N 1250 E,LOGAN,UT,84321,ENGLISH,Active,,MOXXIEO65
1.40776E+11,JUDY,NICKS,6/9/2025,4K63KD4RT09,GIGI BASDEO,PHIL COOK,WELLCARE,Wellcare Dual Access (HMO-POS D-SNP)  H1416-035,DST,7316761944,9/30/1951,1630 E WHEELER ST,DYERSBURG,TN,38024,ENGLISH,Active,,NOT FOUND
1.40643E+11,Patti,Habedank,6/9/2025,100166150WA,JOHN STAMPOLIS,JOHN STAMPOLIS,HUMANA,Humana Gold Plus SNP-DE H5619-167 (HMO D-SNP),DST,5094158558,12/3/1967,1226 Dakota,Wentchee,WA,98801,ENGLISH,Active,,MOXXIEU65
1.40688E+11,Cynthia,Smith,6/9/2025,4TN4V16GN79,WENDY CORONA,WENDY CORONA,UNITED HEALTHCARE,UHC Dual Complete MS-S002 (HMO-POS D-SNP),MCD,6015750111,10/31/1963,7521 Black Zion Rd,Pontotoc,MS,38863,ENGLISH,Active,,MOXXIEU65
1.40686E+11,joseph,gillespie,6/9/2025,3X42TC2GD85,YARISSA FERNANDEZ,YARISSA FERNANDEZ,UNITED HEALTHCARE,UHC Dual Complete AZ-S001 (HMO-POS D-SNP) H0321-002-000,DST,4809250718,9/9/1958,905 E WHITTON AVE,"PHOENIX, MARICOPA",AZ,85014,ENGLISH,Active,,HOTMEDO65
1.4074E+11,douglas,haslett,6/9/2025,9pt3e50jt97,JACLYN LAVERY,JACLYN LAVERY,UNITED HEALTHCARE,UHC Complete Care TX-3P (HMO-POS C-SNP) H0609-062-000,CSNP,8179024067,12/1/1957,9701 Old Agnes Rd,springtown,TX,76082,ENGLISH,Active,,PX JUNE 3 of 5
1.40669E+11,MAHESHWARI,NAIDU,6/9/2025,8GA6U32WK87,CARL CAMPBELL,PHIL COOK,AETNA,Aetna Medicare Select (HMO‑POS) H0523-070,NLS,5107064354,10/10/1952,124 N ROCHESTER ST,SAN MATEO,CA,94401,ENGLISH,Active,,PX Upload May 2025
1.40713E+11,LADORA,BENAKA,6/9/2025,6RE7CD8CD54,TERENCE PHILLIPS,TERENCE PHILLIPS,HUMANA,Humana Gold Plus - Diabetes and Heart (HMO-POS C-SNP) H0028-067-000,SNP,7854387868,11/22/1957,4821 SE 45TH ST,TECUMSEH,KS,66542,ENGLISH,Active,,PX JUNE 3 of 5
1.40677E+11,Velia D,Minjarez,6/9/2025,6AG8HD6GT28,JOSE RODRIGUEZ,INIKIA RAWLINSON,CIGNA,Cigna Preferred Savings Medicare (HMO) H4513-083-004,DST,8303578727,2/7/1948,24210 Sundown Pass,San Antonio,TX,78261,ENGLISH,Active,,MM SPANISH 3
1.40681E+11,YUSHIA,JAO,6/9/2025,2T09MK3NG14,YARISSA FERNANDEZ,YARISSA FERNANDEZ,ANTHEM,Anthem Full Dual Advantage Aligned (HMO D-SNP) H4471-001-000,DIF,4088678884,7/19/1959,13455 HARPER DR,"SARATOGA, SANTA CLARA",CA,95070,ENGLISH,Active,,PX JUNE 4 of 5
1.40681E+11,Larry,Odom,6/9/2025,2YF8PX2NK61,JONATHAN AARON,JONATHAN AARON,UNITED HEALTHCARE,UHC Dual Complete AL-D002 (PPO D-SNP) H1889-009-000,MCD,2057176720,12/29/1971,356 wells loop,jasper,AL,35503,ENGLISH,Active,,MOXXIEU65
1.40696E+11,Barbara,White,6/9/2025,7R32HY8NP03,ADRIANA ARROYAVE,ADRIANA ARROYAVE,UNITED HEALTHCARE,UHC Dual Complete MO-S001 (HMO-POS D-SNP) H0169-002-000,DST,8165087003,4/30/1951,6000 Bircain Pl,Gladstone,MO,64118,ENGLISH,Active,,PX Upload May 2025
1.40669E+11,Ibrahim,BROWN BULGAR,6/9/2025,4N06CY4AA79,RONALD DIAZ,RONALD DIAZ,SIMPLY HEALTH,Simply Complete Platinum (HMO D-SNP) H5471-115-000,DST,7866758381,7/28/1957,52 W 32ND ST,HIALEAH,FL,33012,SPANISH,Active,,PX JUNE
1.4066E+11,Stevie,Daugherty,6/9/2025,2XV0TV2GN15,JON GONZALES,JON GONZALES,AETNA,Aetna Medicare Freedom (PPO) H5521-224-000,MOV,6786219250,4/25/1958,"3219 Lower Tuskegee Rd, lot 4",Tallassee,AL,36078,ENGLISH,Active,,MOXXIEO65
1.40691E+11,kimberly,mullen,6/9/2025,6hu1fy7qn14,JACLYN LAVERY,JACLYN LAVERY,UNITED HEALTHCARE,AARP® Medicare Advantage Extras from UHC MO-10 (HMO-POS) H2802-072-000,DST,4177737685,9/20/1958,3731 s glenstone ave lot 110,springfield,MO,65804,ENGLISH,Active,,HOTMEDO65
1.40623E+11,Chenille,mOLDOVAN,6/9/2025,1JA8D18MF33,ASHLEY FRAZIER,ASHLEY FRAZIER,AETNA,Aetna Medicare Value Plus (HMO-POS) H0523-076-000,DST,4157246455,6/23/1976,835 OFARRELL ST APT 502,SAN FRANCISCO,CA,94109,ENGLISH,Active,,MOXXIEU65
1.40613E+11,CLAUDIA,COOK,6/9/2025,5MP0XU1VD02,LAUREN WILLIAMS,LAUREN WILLIAMS,UNITED HEALTHCARE,AARP Medicare Advantage from UHC IN-0002 (PPO) H2406-037,DST,3179104988,12/3/1958,215 N NOBLE ST,GREENFIELD,IN,46139,ENGLISH,Active,,MOXXIEO65
1.40651E+11,Priscilla,Cardoza,6/9/2025,1WP8TW7FD62,RAQUEL MCCRAY,RAQUEL MCCRAY,UNITED HEALTHCARE,AARP Medicare Advantage from UHC CA-0010 (HMO-POS) ZXPCBK9T1P,IEP2,2097186126,4/22/1960,19667 AMERICAN AVE SPC92,HILMAR,CA,95324,ENGLISH,Active,,MOXXIEO65
1.40428E+11,James,Dugan,6/9/2025,4MX9Y51GP00,ADRIANA ARROYAVE,ADRIANA ARROYAVE,UNITED HEALTHCARE,AARP Medicare Advantage from UHC FL-0006 (HMO-POS) H1045-028-000,DST,2398108898,9/2/1955,26336 IMPERIAL HARBOR BLVD,BONITA SPGS,FL,34135,ENGLISH,Active,,MOXXIEO65
1.40585E+11,A,DE LEON SANTIAGO,6/9/2025,8DR3RV1KE15,JAVIER VALENCIA,JAVIER VALENCIA,UNITED HEALTHCARE,UHC Dual Complete FL-D002 (HMO-POS D-SNP) H1045-039-000,MOV,5617976224,6/16/1947,1214 Ave K,Fort Pierce,FL,34950,SPANISH,Active,,MM SPANISH OUTBOUND
1.40615E+11,ATEF,SHAFIK,6/9/2025,4M41U28FK91,TERENCE PHILLIPS,TERENCE PHILLIPS,AETNA,Aetna Medicare Prime Value Plus (HMO-POS) H4982-021-000,MCD,3105337788,7/3/1959,3858 W 226TH ST APT 203,TORRANCE,CA,90505,ENGLISH,Active,,PX JUNE 4 of 5
1.40581E+11,MAGGIE,GARDNER,6/9/2025,7EG1CR7VA94,BILLY HODGE,BILLY HODGE,HUMANA,Humana Gold Plus SNP-DE H8908-005 (HMO D-SNP) H8908-005-000,IEP,2488976875,8/14/1979,20743 MARIE AVE,WARREN,MI,48089,ENGLISH,Active,,PX JUNE
1.40584E+11,Carol Tony,Trazzare,6/9/2025,9M46AK5QU78,LAURA DREMEL,LAURA DREMEL,HUMANA,Humana Gold Plus SNP-DE H3533-034 (HMO D-SNP),CSNP,6316274518,2/2/1956,427 Village Dr,Patchogue,NY,11772,ENGLISH,Active,,HOTMEDO65
1.40575E+11,SHEILA,HOPKINS,6/9/2025,5EA4CG3XJ86,NICK GONZALES,NICK GONZALES,UNITED HEALTHCARE,UHC Dual Complete MI-S002 (HMO-POS D-SNP) H2247-001-000,MCD,8102687899,9/5/1960,800 E COURT ST APT 217,Flint,MI,48503,ENGLISH,Active,,MOXXIEU65
1.40573E+11,MARIA,SOSA,6/9/2025,7J29RY3FV37,RONALD DIAZ,RONALD DIAZ,UNITED HEALTHCARE,UHC Complete Care TX-3P (HMO-POS C-SNP) H0609-062-000,CSNP,9564044908,6/27/1959,"15436 Northcreek Rd, apt 6101, , TARRANT, TX 76177",Fort Worth,TX,76177,SPANISH,Active,,MM SPANISH 3
1.40564E+11,Terry,Traylor,6/9/2025,7YD4MV5PE93,ANDRE AMORIM,ANDRE AMORIM,UNITED HEALTHCARE,UHC Dual Complete AL-D002 (PPO D-SNP) H1NF7FXST5,DST,2566017338,3/14/1960,2341 County RD 578,Fyffe,AL,35971,ENGLISH,Active,,MOXXIEO65
1.40563E+11,Paul,Haag,6/9/2025,8QG7P86JT68,OSCAR VALIDO,OSCAR VALIDO,UNITED HEALTHCARE,AARP Medicare Advantage Essentials from UHC UT-4 (HMO-POS) H4604-011-000,MOV,5412555819,4/15/1980,"657 Elm Ave, Price, CARBON, UT 84501",price,UT,11234,ENGLISH,Active,,MOXXIEU65
1.40557E+11,RANDALL,ANSCHULTZ,6/9/2025,9MG1XX3JA94,KRISTOFF RAMSOOK,KRISTOFF RAMSOOK,UNITED HEALTHCARE,UHC Dual Complete AR-S001 (PPO D-SNP) H2001-034-000,DST,8702718057,4/6/1965,538 YANKEE RD,JUDSONIA,AR,72081,ENGLISH,Active,,
1.40542E+11,Tania,Long,6/9/2025,8K22A60JD12,ADAM RODRIGUES,ADAM RODRIGUES,UNITED HEALTHCARE,UHC Dual Complete OK-V001 (HMO-POS D-SNP) H5322-033,MCD,4057388733,7/16/1970,914 East Noble Ave,Guthrie,OK,73044,ENGLISH,Active,,MOXXIEU65
1.40549E+11,Veronica,Frempong,6/9/2025,5VM4J17QP09,JONATHAN AARON,JONATHAN AARON,HUMANA,Humana Gold Plus Giveback H1036-318 (HMO-POS,DST,7185138968,4/18/1952,10519 Hugue Way,Charlotte,NC,28214,ENGLISH,Active,,PX Upload May 2025
1.405E+11,LUANNE,SMITH,6/9/2025,1RW4AT9FP67,TERENCE PHILLIPS,TERENCE PHILLIPS,ANTHEM,Anthem Full Dual Advantage Aligned (HMO D-SNP) H4471-001-000,IEP,5598057832,10/23/1960,31618 SIERRA DR SPC 1,EXETER,CA,93221,ENGLISH,Active,,
1.405E+11,CYNTHIA,BLACKWELL,6/9/2025,8R37UK5GH68,ADAM SCOGGINS,ADAM SCOGGINS,AETNA,Aetna Medicare Value Plus (HMO-POS) H0523-074-000,MCD,2099054891,4/12/1958,4245 West Ln Apt 8036,Stockton,CA,95208,ENGLISH,Active,,MOXXIEO65
1.40519E+11,DONNA,MCREYNOLDS,6/9/2025,1XT5CH3HF57,CRISTINA RODRIGUEZ,PHIL COOK,ANTHEM,Anthem Full Dual Advantage Aligned  (HMO D-SNP) H3447-048,MCD,8127602004,7/17/1963,1203 OAKLEY ST,EVANSVILLE,IN,47710,ENGLISH,Active,,PX JUNE 2 of 5
1.40465E+11,ma,gonzalez,6/9/2025,5WP1U57TD92,NATHALY COGLE,INIKIA RAWLINSON,CIGNA,Cigna Preferred Medicare (HMO) H4513-061-002,DST,9566397303,11/18/1944,1030 Flor De Valle Dr,Brownsville,TX,78520,SPANISH,Active,,MM SPANISH 3
1.40498E+11,CALVIN,MOORE,6/9/2025,2RU6N88TR67,BETHANY RAMIREZ,BETHANY RAMIREZ,UNITED HEALTHCARE,AARP Medicare Advantage from UHC TX-0012 (HMO-POS) H4527-002-000,DST,2549104765,2/12/1967,2701 SANGER AVE,WACO,TX,76707,ENGLISH,Active,,MOXXIEU65
1.40264E+11,Richard,Todd,6/9/2025,7J58AR6UU38,OMAR GARCIA,OMAR GARCIA,HUMANA,Humana Gold Plus SNP-DE H5619-168 (HMO D-SNP) H5619-168-000,MCD,4255450356,12/31/1959,17828 SE 140TH ST,Renton,WA,98058,ENGLISH,Active,,MOXXIEO65
1.40418E+11,Suzanne,Cantrell,6/9/2025,8DA8CG1UR62,NICK GONZALES,NICK GONZALES,UNITED HEALTHCARE,AARP Medicare Advantage from UHC TX-0011 (HMO-POS) H4527-001-000,DST,3612122787,4/17/1961,130 Antlers Ln,Victoria,TX,77905,ENGLISH,Active,,MOXXIEU65
1.40496E+11,SHAWNA,FINZER,6/9/2025,7MG3QQ8XC95,LOUIS MARQUEZ,LOUIS MARQUEZ,UNITED HEALTHCARE,UHC Dual Complete OH-S2 (HMO-POS D-SNP) H1285-001-000,MCD,3305464479,5/27/1972,4955 HIGBEE AVE NW APT 419,CANTON,OH,44717,ENGLISH,Active,,MOXXIEU65
1.40446E+11,WILBUR,SPENCER,6/9/2025,4HH4F20NK63,ARTEMISA CARVALHO,INIKIA RAWLINSON,UNITED HEALTHCARE,AARP Medicare Advantage Extras from UHC KY-5 (HMO-POS) H5253-128-000,DST,5024090841,2/22/1953,2221 bolling apt3,Louisville,KY,40210,ENGLISH,Active,,MOXXIEO65
1.40446E+11,DONNA,COMER,6/9/2025,4FG1TH1DK12,BENNY BENJARARA,BENNY BENJARARA,UNITED HEALTHCARE,UHC Dual Complete FL-Y5 (HMO-POS D-SNP) H2509-003-000,MCD,9048817156,2/13/1953,425 celery ave n,jacksonville,FL,32220,ENGLISH,Active,,MOXXIEO65
1.40486E+11,ELIZABETH,NAGEL-HINTZ,6/9/2025,6ET7C29RX71,TERENCE PHILLIPS,TERENCE PHILLIPS,UNITED HEALTHCARE,UHC Dual Complete IN-S001 (PPO D-SNP) H2001-064-000,INT,2195081741,7/28/1970,5054 N PAWNEE TRL APT 17,LAPORTE,IN,46350,ENGLISH,Re-write,,
1.40477E+11,VALENCIA,WOOLFOLK,6/9/2025,5J78TJ9PM55,ARTEMISA CARVALHO,PHIL COOK,UNITED HEALTHCARE,UHC Dual Complete OH-D001  (HMO-POS D-SNP) H5253-059,MOV,2165627832,10/23/1974,1541 E 191ST ST APT 221,EUCLID,OH,44117,ENGLISH,Active,,HappyQuote
1.40486E+11,clara,luke,6/9/2025,2rw5m64tp87,JACLYN LAVERY,JACLYN LAVERY,UNITED HEALTHCARE,AARP® Medicare Advantage Extras from UHC TX-27 (HMO-POS) H0609-061-000,DST,9455451959,8/21/1944,9901 scyene rd apt 29101,dallas,TX,75227,ENGLISH,Active,,HOTMEDO65
1.40471E+11,BLANCA,VILLEGAS,6/9/2025,8Y63NJ9PK73,KRISTOFF RAMSOOK,KRISTOFF RAMSOOK,UNITED HEALTHCARE,AARP Medicare Advantage CareFlex from UHC TX-44 (HMO-POS) H0609-077-000,DST,6823523577,9/29/1967,6861 MEADOW CREST DR APT 513,NORTH RICHLAND HILLS,TX,76180,ENGLISH,Active,,PX JUNE 3 of 5
1.40136E+11,aaron,popour,6/9/2025,6DU8UD2XN24,BILLY HODGE,BILLY HODGE,HUMANA,Humana USAA Honor Giveback with Rx (PPO) H5216-305-000,MCD,9064202983,12/17/1964,6093 COUNTY 420 21ST RD,GLADSTONE,MI,49837,ENGLISH,Active,,MOXXIEU65
1.40427E+11,JEAN,CADET,6/9/2025,1UM6DP7PY87,BETHANY RAMIREZ,BETHANY RAMIREZ,UNITED HEALTHCARE,UHC Dual Complete PA-S002 (HMO-POS D-SNP) H3113-009-000,NLS,2673515494,9/4/1959,1101 ELBRIDGE ST,PHILADELPHIA,PA,19111,ENGLISH,Active,,MOXXIEO65
1.40264E+11,Faith,Dunshee,6/9/2025,3ED6WG2VE44,TERENCE PHILLIPS,TERENCE PHILLIPS,UNITED HEALTHCARE,UHC Dual Complete MI-S3 (HMO D-SNP) H2247-004-000,MCD,2313405532,10/23/1972,"2490 MAXWELL RD, PETOSKEY, EMMET, MI 49770",Petoskey,MI,49770,ENGLISH,Active,,
1.40417E+11,Ruby,Wilson,6/9/2025,5U27KF4QJ68,ADAM RODRIGUES,ADAM RODRIGUES,HUMANA,Humana Gold Plus Giveback H1036-318 (HMO-POS) H1036-318,DST,7047012551,8/2/1954,2668 Golf Ball Circle,Concord,NC,28024,ENGLISH,Active,,MOXXIEU65
1.40379E+11,Maureen,Papapietro,6/9/2025,6Q81WF4RW34,LAURA DREMEL,LAURA DREMEL,UNITED HEALTHCARE,AARP Medicare Advantage from UHC PA-0011 (PPO) H2406-072-000,IEP,7173642879,4/25/1960,"24 E High St, Apt B, Hummelstown,","Hummelstown, DAUPHIN, PA 17036",PA,17036,ENGLISH,Active,,MOXXIEO65
1.4044E+11,Zachary,Kelly,6/9/2025,9QJ4AM3DK64,ASHLEY FRAZIER,INIKIA RAWLINSON,HUMANA,Humana Gold Plus SNP-DE H6622-086 (HMO D-SNP) H6622-086-000,MCD,4439221150,12/26/1960,721 N Lakewood Ave,Baltimore,MD,21205,ENGLISH,Active,,
1.38917E+11,Deborah,Miller,6/7/2025,6F78JC3UX44,CRISTINA RODRIGUEZ,CRISTINA RODRIGUEZ,HUMANA,56FTZ2XJCL Humana Gold Plus - Diabetes and Heart (HMO C-SNP) H0028-039-000,CSNP,2103181426,9/16/1964,"1006 MERCER DR, SAN ANTONIO, BEXAR, TX 78245",san anotnio,TX,78245,ENGLISH,Future Active Policy,,MOXXIEU65
1.39239E+11,Bill T,Komok,6/7/2025,1t90d01ey07,CARL CAMPBELL,KIMBERLY BUCHANAN,WELLCARE,Wellcare Simple (HMO-POS) H0913-002,DIF,9738612223,1/1/1955,35 Barbour St Apt 3,HALEDON,NJ,7508,ENGLISH,No Carrier Match,,
1.39046E+11,CARROLL,DEL PORTILLO,6/7/2025,6A57KQ1GF78,NATHALY COGLE,NATHALY COGLE,UNITED HEALTHCARE,UHC Dual Complete NY-S001 (PPO D-SNP) H2001-063-002,MCD,9178081433,2/13/1959,746 E 23RD ST,BROOKLYN,NY,11210,SPANISH,Unknown,,MOXXIEO65
1.39205E+11,JOSE,RIOS GONZALEZ,6/7/2025,4TJ7EJ5RQ57,LOUIS MARQUEZ,LOUIS MARQUEZ,HUMANA,Humana Dual Select H5619-165 (HMO D-SNP) H5619-165-000,MCD,5098818750,8/18/1957,518 2ND ST APT A,WENATCHEE,WA,98801,SPANISH,Unknown,,HOTMEDO65
1.39205E+11,mona,mann,6/7/2025,1TU7X73GG79,WENDY CORONA,WENDY CORONA,AETNA,Aetna Medicare Select (HMO-POS),DST,9167679271,9/17/1963,925 E ST APT 39,sacramento,CA,95814,ENGLISH,No Carrier Match,,MOXXIEU65
1.39147E+11,DOROTHY,YOUNG,6/7/2025,7KH0TH5QQ27,TERENCE PHILLIPS,TERENCE PHILLIPS,UNITED HEALTHCARE,UHC Dual Complete GA-S3 (HMO-POS D-SNP) H5322-045-000,DST,2292062753,6/4/1958,452 W Madison Ave,Ashburn,GA,31714,ENGLISH,Unknown,,MOXXIEO65
1.39144E+11,DEBORAH,TANNER,6/7/2025,6T98RR6WN40,CARL CAMPBELL,CARL CAMPBELL,UNITED HEALTHCARE,UHC Dual Complete MO-S3 (HMO-POS D-SNP) H0169-009-000,DST,8169151051,5/7/1953,11308 DONNELLY AVE,KANSAS CITY,MO,64134,ENGLISH,Unknown,,MOXXIEO65
1.39174E+11,EDUARDO,VEGA,6/7/2025,8DH0TY3WM24,TERENCE PHILLIPS,TERENCE PHILLIPS,UNITED HEALTHCARE,UHC Dual Complete TX-D002 (HMO-POS D-SNP) H4514-023-000,DST,8328068377,6/20/1966,"4602 29TH ST, DICKINSON","DICKINSON,",TX,77539,ENGLISH,Unknown,,PX JUNE 3 of 5
1.38788E+11,MANDY,FIELDS,6/7/2025,5EM4XR8VG73,KRISTOFF RAMSOOK,KRISTOFF RAMSOOK,WELLCARE,Wellcare Simple (HMO-POS) H1416-077-000,IEP2,8652021755,1/5/1960,640 BRANAM HOLLOW RD,GATLINBURG,TN,37738,ENGLISH,No Carrier Match,,HOTMEDO65
1.39172E+11,theodore,glore II,6/7/2025,2qn4w45rh75,JACLYN LAVERY,JACLYN LAVERY,AETNA,Aetna Medicare Giveback Choice (PPO) H5521 ‑ 476 | $0 Plan Premium,MCD,2176958187,12/9/1966,26176 mount hennan cut rd,kentwood,LA,70444,ENGLISH,No Carrier Match,,MOXXIEU65
1.39138E+11,KENNETH,GENTILINI,6/7/2025,1GH7KN9GC36,BETHANY RAMIREZ,BETHANY RAMIREZ,HUMANA,HumanaChoice SNP-DE H5216-296 (PPO D-SNP) H5216-296-000,MCD,3854448661,12/16/1964,6036 W WHISTLE STOP RD,SOUTH JORDAN,UT,84009,ENGLISH,Unknown,,MOXXIEU65
1.39178E+11,ODESSA,SEYMOUR,6/7/2025,3CD5TF0VA71,LOUIS MARQUEZ,LOUIS MARQUEZ,HUMANA,HumanaChoice H5216-347 (PPO) H5216-347-000,NLS,8644348954,4/26/1951,21 ZARLINE ST,GREENVILLE,SC,29611,ENGLISH,Future Active Policy,,HOTMEDO65
1.3917E+11,Candy,Ward,6/7/2025,4RY7UP4DV34,ADRIANA ARROYAVE,ADRIANA ARROYAVE,UNITED HEALTHCARE,AARP Medicare Advantage from UHC PA-0002 (HMO-POS) H5253-146-000,SNP,5707915265,5/30/1963,103 NICHECRONK RD UNIT 502,DINGMANS FERRY,PA,18327,ENGLISH,Duplicate,,MOXXIEU65
1.38769E+11,KELLY,JINRIGHT,6/7/2025,3yk0g57hd38,BENNY BENJARARA,BENNY BENJARARA,UNITED HEALTHCARE,AARP Medicare Advantage from UHC TX-0026 (HMO-POS) H0609-060-000,DST,9033682107,5/29/1968,106 orchard st.,ALBA,TX,75410,ENGLISH,Unknown,,MOXXIEU65
1.39034E+11,Robert,Edwards,6/7/2025,9FF6FF7jT76,ANDRE AMORIM,ANDRE AMORIM,UNITED HEALTHCARE,UHC Dual Complete  FL-D003 (PPO D-SP) 3L9FRT5D6G,DST,4482294908,2/12/1959,3983 bristol hwy,quincy,FL,32351,ENGLISH,Unknown,,MOXXIEO65
1.38761E+11,margaret,monroe,6/7/2025,4fc5d99ny79,JACLYN LAVERY,JACLYN LAVERY,UNITED HEALTHCARE,UHC Dual Complete SC-S2 (PPO D-SNP) H2001-075-000,DST,8435432011,7/2/1957,1139 mickey  st   mailing po box 312,turbeville,SC,29162,ENGLISH,Unknown,,MOXXIEO65
1.38828E+11,PHRONIA,GODSEY,6/6/2025,9Y93VA2ME71,SABRINA GONZALES,SABRINA GONZALES,UNITED HEALTHCARE,UHC Dual Complete KY-S001 (PPO D-SNP),DST,6069100263,10/15/1958,2726 LOTTS CREEK RD,HAZARD,KY,41701,ENGLISH,Unknown,,HOTMEDO65
1.38836E+11,ELIZABETH,THOMAS,6/6/2025,5D60HA2QT19,BETHANY RAMIREZ,BETHANY RAMIREZ,HUMANA,Humana Full Access H5216-287 (PPO) H5216-287-000,IEP,5866250820,5/22/1960,28 DOROTHEA ST,MOUNT CLEMENS,MI,48043,ENGLISH,Unknown,,MOXXIEO65
1.38787E+11,Wendell,Pratt,6/6/2025,7DT3QF9UM11,ASHLEY FRAZIER,ASHLEY FRAZIER,HUMANA,Humana USAA Honor Giveback with Rx (PPO) H5216-340-000,DST,4029421228,11/5/1952,250 e pine st,rising city,NE,68658,ENGLISH,Future Active Policy,,MOXXIEO65
1.38768E+11,Raul,Acosta,6/6/2025,2ec9j13td22,OLGA GRAJALES,OLGA GRAJALES,UNITED HEALTHCARE,UHC Dual Complete FL-Y4 (PPO D-SNP),INT,3057269002,4/2/1937,1655ne miami garden dr apto 107,Miami,FL,33179,ENGLISH,Unknown,,HOTMEDO65
1.38809E+11,Eva,SCHWARTZ,6/6/2025,3H74GQ2XU81,ARTEMISA CARVALHO,SARAH SANZ,HUMANA,Humana Gold Plus H0028-027-0,DST,6028121931,9/21/1954,11410 S MANDAN ST,PHOENIX,AZ,85043,ENGLISH,Future Active Policy,,PX JUNE 2 of 5
1.38839E+11,Timothy,Darnell,6/6/2025,3vk7dd4vj44,ASHLEY FRAZIER,ASHLEY FRAZIER,HUMANA,Humana Gold Plus - Diabetes and Heart (HMO C-SNP) H5619-046-000,CSNP,2624165976,10/26/1959,105 SUITE LIFE CIR STE D-4,NEWPORT NEWS,VA,23606,ENGLISH,Future Active Policy,,PX JUNE
1.38787E+11,Helen,Still,6/6/2025,2YK9J27WE49,ADAM RODRIGUES,ADAM RODRIGUES,HUMANA,Humana Gold Plus Giveback H5619-169 (HMO) H5619-169,DST,8035918538,3/22/1956,411 Chavis Road,Blackville,SC,29817,ENGLISH,Future Active Policy,,MOXXIEO65
1.38851E+11,brenda,sapp,6/6/2025,1QF1P67KV09,OSCAR VALIDO,OSCAR VALIDO,HUMANA,Humana Gold Plus Integrated SNP-DE H5619-054 (HMO-POS D-SNP) H5619-054-000,DST,7657199763,4/17/1960,3092 VAN BIBBER Lake EST APT C9,greencastle,IN,46135,ENGLISH,Cancelled,,MOXXIEO65
1.38776E+11,mary,almaroad,6/6/2025,4AU4DF0EE77,JEREMY RAMOS,JEREMY RAMOS,WELLPOINT,Wellpoint Full Dual Advantage Support (HMO D-SNP) H5828-001-000,MCD,2769670751,7/1/1971,1336 virginua ave,bristol,TN,37620,ENGLISH,No Carrier Match,,MOXXIEU65
1.38837E+11,PATRICIA,ALSPACH,6/6/2025,6MN0G06CY18,CARL CAMPBELL,CARL CAMPBELL,UNITED HEALTHCARE,AARP Medicare Advantage Extras from UHC NE-5 (HMO-POS) H2802-074-000,DST,3025690877,6/4/1960,3701 MCKINLEY ST LOT 36A,OMAHA,NE,68112,ENGLISH,Unknown,,PX JUNE 3 of 5
1.38831E+11,VIRGINIA,VILLA,6/6/2025,3MM4A94KW65,KRISTOFF RAMSOOK,KRISTOFF RAMSOOK,HUMANA,Humana Gold Plus - Diabetes and Heart (HMO C-SNP) H0028-077-000,CSNP,6026392073,12/21/1951,734 E DESERT DR S,PHOENIX,AZ,85042,ENGLISH,Future Active Policy,,MM SPANISH 3
1.3872E+11,PAWEH,HTI,6/6/2025,9HK2ET0HP18,JOSE RODRIGUEZ,JOSE RODRIGUEZ,UNITED HEALTHCARE,AARP Medicare Advantage Extras from UHC NE-5 (HMO-POS) H2802-074-000,DST,5312137454,5/31/1979,6502 N 40TH ST,OMAHA,NE,68112,SPANISH,Unknown,,MOXXIEU65
