Record ID,First Name,Last Name,DATE,MBI NUMBER,CLOSER,ENROLLER,CARRIER,FULL PLAN NAME & CODE,SEP,Mobile Phone Number,Date of birth,Street Address,City,STATE,Postal Code,LANGUAGE,STATUS,Status,LEAD SOURCE
1.58885E+11,JEANETTE,TAYLOR,6/30/2025,5NV3Q95WC76,RAQUEL MCCRAY,RAQUEL MCCRAY,WELLCARE,Wellcare Simple (HMO) H1032-205-000,DST,9043498986,3/18/1950,"3018 GREEN ST, JACKSONVILLE, DUVAL, FL 32205",duval,FL,32205,ENGLISH,Active,,MM ENGLISH 2
1.58875E+11,KATHLEEN,MURPHY,6/30/2025,8WH7M43UY44,MARA BLOOM,PHIL COOK,UNITED HEALTHCARE,UHC Complete Care WI-1 (PPO C-SNP) H0294-002,CSNP,7158518123,7/29/1961,N8610 OAK ST APT 4,BOWLER,WI,54416,ENGLISH,Active,,
1.58783E+11,Audley,Hall,6/30/2025,4QU6ND7AJ81,JOHN STAMPOLIS,INIKIA RAWLINSON,CIGNA,Cigna Alliance Medicare (HMO) H0354-028,DST,7189741561,9/30/1953,314 n chippewa place,chandler,AZ,85224,ENGLISH,Active,,MOXXIEO65
1.58881E+11,evelyn,green,6/30/2025,1TC1YG2XR23,JEREMY RAMOS,JEREMY RAMOS,UNITED HEALTHCARE,UHC Dual Complete NC-S3 (HMO-POS D-SNP) H5253-184-000,MCD,2523770766,7/6/1956,100 NC HIGHWAY 125 APT 323,roanoke rapids,NC,27870,ENGLISH,Active,,NOT FOUND
1.58783E+11,GOLDIE,HENRY,6/30/2025,3UN3YY6CX07,RAQUEL MCCRAY,RAQUEL MCCRAY,UNITED HEALTHCARE,AARP Medicare Advantage Giveback from UHC TC-4 (HMO-POS),DST,8652421467,10/7/1956,"524 NURSERY RD, DANDRIDGE, JEFFERSON, TN 37725",JEFFERSON,TN,37725,ENGLISH,Active,,MM ENGLISH
1.58764E+11,Charles,Davis JR,6/30/2025,6Y68YP4GP26,JON GONZALES,JON GONZALES,UNITED HEALTHCARE,UHC Complete Care AR-6 (PPO C-SNP) H1889-025-000,CSNP,7605908914,11/5/1964,3000 W AVENUE B ST APT 71,Hope,AR,71801,ENGLISH,Active,,HappyQuote
1.58863E+11,ELIZABETH,NAGEL-HINTZ,6/30/2025,6ET7C29RX71,TERENCE PHILLIPS,TERENCE PHILLIPS,ANTHEM,Anthem Full Dual Advantage (HMO D-SNP) H3447-020-000,DST,2195081741,7/28/1970,5054 N PAWNEE TRL APT 17,LAPORTE,LA,46350,ENGLISH,Active,,
1.58844E+11,DOROTHY,NICKERSON,6/30/2025,1MK3M29JW04,SABRINA GONZALES,SABRINA GONZALES,HUMANA,Humana USAA Honor Giveback with Rx (PPO),DST,6063756240,5/25/1960,426 CENTRAL AVE,MAYSVILLE,KY,41056,ENGLISH,Active,,MOXXIEO65
1.58863E+11,LOIS J,GRANT,6/30/2025,7DW7FN6YN65,ASHLEY FRAZIER,KIMBERLY BUCHANAN,ZING,Zing Select Diabetes & Heart OH (HMO C-SNP) H4624-034-000,CSNP,4402256722,9/6/1939,244 COVE BEACH AVE,SHEFFIELD LAKE,OH,44054,ENGLISH,Active,,MM ENGLISH 3
1.58843E+11,STEVE,OLIVER,6/30/2025,6HD3YH2JX09,ADAM SCOGGINS,ADAM SCOGGINS,UNITED HEALTHCARE,AARP Medicare Advantage Patriot No Rx SC-MA01 (HMO-POS) H5322-043-000,MOV,8033604782,1/26/1954,1227 State Rd S-40-1322,Eastover,SC,29044,ENGLISH,Active,,HappyQuote
1.58843E+11,mark,edger,6/30/2025,7D10YH5KF14,YARISSA FERNANDEZ,YARISSA FERNANDEZ,UNITED HEALTHCARE,AARP Medicare Advantage Giveback from UHC IN-20 (HMO-POS) H2802-059-000,MCD,2699455366,1/25/1952,"162 LIONS CREEK CT N,","NOBLESVILLE, HAMILTON",IN,46062,ENGLISH,,,MOXXIEO65
1.58844E+11,Ann,Graham,6/30/2025,7Y27P60TU65,OSCAR VALIDO,OSCAR VALIDO,ANTHEM,Anthem Full Dual Advantage (HMO D-SNP),INT,4403413268,5/17/1956,"12400 MADISON AVE APT 503, LAKEWOOD, CUYAHOGA, OH 44107",cuyahoga,OH,44107,ENGLISH,Active,,MOXXIEO65
1.58844E+11,Deborah,Martin,6/30/2025,2TN9D82YG34,KEVIN YOUNG,KEVIN YOUNG,UNITED HEALTHCARE,AARP Medicare Advantage Patriot No Rx MS-MA01 (PPO) H8768-031-000,DST,6017241405,2/8/1950,303 LAKE BREEZE DR,Brandon,MS,39047,ENGLISH,Active,,MM SPANISH JUNE
1.58783E+11,ETHEL,GARNER,6/30/2025,9TW0V33XH22,LOUIS MARQUEZ,LOUIS MARQUEZ,WELLCARE,Wellcare Giveback (HMO-POS) H1215-003-000,MOV,4022983442,9/21/1952,"3483 larimore ave, apt 313",omaha,NE,68111,ENGLISH,Active,,MOXXIEO65
1.5884E+11,johnnie,moore,6/30/2025,7XR9A77MK49,BILLY HODGE,BILLY HODGE,HUMANA,Humana Gold Plus H5619-089 (HMO) H5619-089-000,MCD,2565415913,3/1/1960,225 BINFORD DR SW APT B,HUNTSVILLE,AL,35805,ENGLISH,Active,,MOXXIEO65
1.58763E+11,Georgia,Swank,6/30/2025,1NW9QA7HK24,ADAM RODRIGUES,ADAM RODRIGUES,HUMANA,HumanaChoice Giveback H5216-322 (PPO),ICEP,5023811428,9/26/1957,9076 Charleston Way,Shelbyville,KY,40065,ENGLISH,Active,,MOXXIEO65
1.58854E+11,gilbert,villalovas,6/30/2025,2GU3JT4UQ76,JEREMY RAMOS,JEREMY RAMOS,UNITED HEALTHCARE,AARP Medicare Advantage Giveback from UHC CO-12 (PPO) H2406-103-000,LCC,7194598163,9/17/1954,7050 SEQUOYAH WAY,el paso,CO,80915,ENGLISH,Active,,MOXXIEO65
1.58837E+11,Henry,Errickson,6/30/2025,6M38WA7UN42,AIDAN DECAMILLO,AIDAN DECAMILLO,UNITED HEALTHCARE,AARP Medicare Advantage from UHC NJ-6 (PPO) H8768-058-000,OEP-N,7325138386,7/10/1958,157 Wyckoff Rd,Eatontown,NJ,7724,ENGLISH,Active,,MOXXIEO65
1.58783E+11,VIOLETA,MCDERMOTT,6/30/2025,2W50HK5KQ46,NATHALY COGLE,NATHALY COGLE,SIMPLY HEALTH,Simply Level Platinum (HMO C-SNP) H5471-116-000,CSNP,7863556939,8/22/1940,2030 S DOUGLAS RD APT 711,CORAL GABLES,FL,33134,SPANISH,Active,,NOT FOUND
1.58783E+11,ANDREA,GREENE,6/30/2025,8HH8R40MV21,TERENCE PHILLIPS,TERENCE PHILLIPS,UNITED HEALTHCARE,AARP Medicare Advantage CareFlex from UHC WI-18 (HMO-POS) H5253-198-000,DST,6087744053,1/23/1968,9530 N PINE RD,"MILTON, ROCK, WI 53563",WI,53563,ENGLISH,Active,,MOXXIEU65
1.58813E+11,mary,brooks,6/30/2025,5805670344,LAUREN WILLIAMS,LAUREN WILLIAMS,HUMANA,HumanaChoice H5216-337 (PPO) H5216-337-001,DST,5805670344,5/19/1970,506 N FLORIDA AV,mangum,OK,73554,ENGLISH,Active,,PX JUNE 2
1.58835E+11,colin,oreilly,6/30/2025,7HQ5Y22QG75,LAUREN WILLIAMS,LAUREN WILLIAMS,HUMANA,Humana Full Access Giveback H5216-393 (PPO) H5216-393-000,IEP,4072798221,6/16/1960,"902 BONNEVILLE LN, KISSIMMEE, POLK, FL 34759",kissimmee,FL,34758,ENGLISH,Active,,PX Upload May 2025
1.58835E+11,RICHARD,KOGER,6/30/2025,2GX6XG2CU72,MARA BLOOM,MARIA PIANTANIDA,UNITED HEALTHCARE,UHC Complete Care Support TX-1A (Regional PPO C-SNP) R6801-008-000,CSNP,8706480158,5/2/1954,3333 NICHOLS DR APT 263,TEXARKANA,TX,75503,ENGLISH,Active,,MM ENGLISH
1.58783E+11,GERONIMO,OSEGUERA NOLASCO,6/30/2025,9U66UV2PQ56,JAVIER VALENCIA,JAVIER VALENCIA,UNITED HEALTHCARE,AARP Medicare Advantage Giveback from UHC UT-9 (PPO) H2001-131-000,DST,7723320102,6/18/1949,2867 S 3000 W,WEST HAVEN,UT,84400,SPANISH,Active,,NOT FOUND
1.58835E+11,NORMAN,CRUM,6/30/2025,3HD4W25WX99,ARTEMISA CARVALHO,SARAH SANZ,UNITED HEALTHCARE,UHC Sharp Medicare Advantage CA-001P (HMO-POS) H0543-145,DST,4422224583,3/22/1955,1747montgomery dr VISTA,SAN DIEGO,CA,92084,ENGLISH,Duplicate,,
1.58835E+11,REGINALD,WHITENING,6/30/2025,5nc1gf7wu95,BETHANY RAMIREZ,SARAH SANZ,WELLCARE,Wellcare Simple (HMO) H1032-201-000,DST,6562445659,2/9/1960,"3014 N 42ND ST,",tampa,FL,33604,ENGLISH,Active,,HOTMED AGED 5/20
1.58833E+11,John,Pratt,6/30/2025,1F43VX0PX91,DANIEL GREENSTEIN,DANIEL GREENSTEIN,HUMANA,HumanaChoice - Diabetes and Heart (PPO C-SNP) H5216-372-000,CSNP,4054761018,2/25/1959,5567 NW 50th St#E,Oklahoma City,OK,73121,ENGLISH,Active,,
1.58813E+11,Margarita,Robison,6/30/2025,7WC2WK5TM00,BILLY HODGE,BILLY HODGE,UNITED HEALTHCARE,UHC Dual Complete IN-S001 (PPO D-SNP) H2001-064-000,MCD,2602265421,5/16/1959,"650 SAVANNAH LN, APT G",GARRETT,IN,46738,ENGLISH,Active,,PX JUNE 2
1.58783E+11,LUCY,LEE,6/30/2025,4VH5DM0MP56,OSCAR VALIDO,PHIL COOK,HUMANA,Humana Gold Plus - Diabetes (HMO C-SNP) H5619-154,CSNP,3609067236,1/31/1954,5103 NE 72ND CIR,VANCOUVER,WA,98661,ENGLISH,Active,,MOXXIEO65
1.58833E+11,Lorenzo,Waller,6/30/2025,7XK6W32MQ49,JON GONZALES,JON GONZALES,HUMANA,HumanaChoice Giveback H5216-308 (PPO) H5216-308-000,MOV,4344830921,11/12/1956,20 Valley Dr,Rustburg,VA,24588,ENGLISH,Active,,MOXXIEO65
1.58831E+11,CHRISTINE,ORLANDO,6/30/2025,5DT9TW9HM52,WENDY CORONA,WENDY CORONA,HUMANA,Humana Gold Plus SNP-DE H8908-005 (HMO D-SNP) H8908-005-000,MCD,5869443319,10/3/1957,7218 DALE,CENTER LINE,MI,48015,ENGLISH,Active,,MOXXIEO65
1.58831E+11,NORMAN,CRUM,6/30/2025,3HD4W25WX99,ARTEMISA CARVALHO,INIKIA RAWLINSON,UNITED HEALTHCARE,UHC Sharp Medicare Advantage CA-001P (HMO-POS) H0543-145-000,DST,4422224583,3/22/1955,1747montgomery dr,VISTA,CA,92084,ENGLISH,Active,,
1.58829E+11,Chevese,Jones,6/30/2025,7N18V96WH65,ADAM RODRIGUES,ADAM RODRIGUES,ANTHEM,Anthem Full Dual Advantage Aligned (HMO D-SNP) H4471-001,MCD,9162481994,2/20/1964,470 Jessie Ave APT 23,Sacramento,CA,95837,ENGLISH,Active,,MOXXIEU65
1.58783E+11,lynette,nelson,6/30/2025,1GH1JH9CJ21,GEORGE GUENTHER,GEORGE GUENTHER,ANTHEM,Anthem Full Dual Advantage (HMO D-SNP) H3447-020-000,MCD,2602062673,11/26/1973,"4378 QUEEN ST APT K 107, FORT WAYNE, ALLEN, IN 46806",fort wayne,IN,46806,ENGLISH,Active,,MOXXIEU65
1.58817E+11,SHELLEY,MASK,6/30/2025,1HG8CN6QP25,TERENCE PHILLIPS,TERENCE PHILLIPS,UNITED HEALTHCARE,UHC Dual Complete TX-S001 (Regional PPO D-SNP) R6801-011-000,IEP2,9409023957,3/22/1960,1000 BELLA VISTA DR APT 116,GAINESVILLE,TX,76240,ENGLISH,Active,,MOXXIEO65
1.58807E+11,Phillip,Spurlock,6/30/2025,8H78KV1DX54,ARMAND SEGU,ARMAND SEGU,UNITED HEALTHCARE,UHC Dual Complete FL-Y5 (HMO-POS D-SNP),MCD,8633551054,3/2/1955,325 JONES RD,AUBURNDALE,FL,3823,ENGLISH,Active,,MOXXIEO65
1.58507E+11,DEBRA,MEEKS,6/30/2025,9X48D39XV49,WENDY CORONA,WENDY CORONA,UNITED HEALTHCARE,AARP Medicare Advantage from UHC AL-0003 (HMO-POS) H2802-041-000,ACC,3342213050,4/3/1962,226 BOND RD,DEATSVILLE,AL,36022,ENGLISH,Active,,MOXXIEU65
1.5882E+11,DORA,ENCIZO,6/30/2025,3uv9d51kx43,BENNY BENJARARA,BENNY BENJARARA,ANTHEM,Anthem Full Dual Advantage Aligned (HMO D-SNP) H4471-001-000,MCD,5593012007,3/21/1961,2026 E KAVILAND AVE,FRESNO,CA,93706,ENGLISH,Active,,MOXXIEU65
1.58783E+11,Andrew,Acuna,6/30/2025,8WC0XV1AK08,ASHLEY FRAZIER,ASHLEY FRAZIER,AETNA,Aetna Medicare Prime (HMO-POS) H4982-026-000,DST,9516698217,9/8/1951,43340 BEVERLEE CIR,Hemet,CA,92544,ENGLISH,Active,,MOXXIEO65
1.58803E+11,willie,key,6/30/2025,2RR1WU4CC33,GEORGE GUENTHER,GEORGE GUENTHER,HUMANA,HumanaChoice Giveback H5216-345 (PPO) H5216-345-000,IEP,2295891122,5/13/1960,"210 RUTH ST, MOULTRIE, COLQUITT, GA 31768",MOULTRIE,GA,31768,ENGLISH,Active,,MOXXIEO65
1.58763E+11,MARGARET,JIMENEZ,6/30/2025,4D02RA5NJ96,LOUIS MARQUEZ,LOUIS MARQUEZ,WELLCARE,Wellcare Dual Liberty (HMO D-SNP) H5590-008-000,MCD,9284204662,10/22/1944,10055 AZ-69,Mayer,AZ,86333,ENGLISH,Active,,HappyQuote
1.58819E+11,Wayne,Bragg,6/30/2025,5K88TJ5DC57,DANIEL GREENSTEIN,DANIEL GREENSTEIN,HUMANA,Humana Gold Plus Giveback H1036-318 (HMO-POS) H1036-318-000,DST,7432098208,5/21/1956,1906 W CONE BLVD,GREENSBORO,NC,27407,ENGLISH,Active,,MOXXIEO65
1.58804E+11,CHARLES,HECTOR JR,6/30/2025,6NV7DQ8GK43,STEVEN TORRES,STEVEN TORRES,UNITED HEALTHCARE,AARP Medicare Advantage from UHC MO-0002 (PPO) H2406-068-000,NLS,5732907359,9/1/1966,PO BOX 397,MORLEY,MO,63766,ENGLISH,Active,,MOXXIEU65
1.58803E+11,KAREN,HISHINUMA,6/30/2025,2D35EU3PV78,ADAM SCOGGINS,ADAM SCOGGINS,UNITED HEALTHCARE,UHC MedicareMax Medicare Advantage FL-0028 (HMO) H5420-001-000,DST,3055427389,12/28/1944,2611 SW 32ND AVE,MIAMI,FL,33133,ENGLISH,Active,,HappyQuote
1.58806E+11,VICKEY,TALLEY,6/30/2025,8MU6CV8FW81,CRISTINA RODRIGUEZ,CRISTINA RODRIGUEZ,UNITED HEALTHCARE,UHC Dual Complete AL-D001 (HMO-POS D-SNP),MOV,2056039912,8/14/1966,526 COUNTY ROAD 1742,CULLMAN,AL,35083,ENGLISH,Active,,HappyQuote
1.58817E+11,Joseph,Wysong,6/30/2025,3FR5WA8UR84,JON GONZALES,JON GONZALES,UNITED HEALTHCARE,UHC Dual Complete TX-S003 (HMO-POS D-SNP) H4514-021-000,MCD,4304373411,8/16/1945,21007 FM 1252 W,Winona,TX,75792,ENGLISH,Active,,MOXXIEU65
1.58804E+11,michael,bullard,6/30/2025,3V11X58AX18,JEREMY RAMOS,JEREMY RAMOS,UNITED HEALTHCARE,UHC Dual Complete FL-Y5 (HMO-POS D-SNP) H2509-003-000,MCD,8502573474,8/26/1956,613 BARTON AVE,panama city,FL,32403,ENGLISH,Active,,HappyQuote
1.58817E+11,Mamie,Seagroves,6/30/2025,4RA8CK7NF63,JON GONZALES,JON GONZALES,UNITED HEALTHCARE,UHC Dual Complete TX-D002 (HMO-POS D-SNP) H4514-023-000,MCD,4304373411,2/16/1967,21007 FM 1252 W,Winona,TX,75792,ENGLISH,Active,,MOXXIEU65
1.58803E+11,HEIDEMARIE,DOWNING,6/30/2025,8EQ5Q07UC72,BETHANY RAMIREZ,BETHANY RAMIREZ,ANTHEM,Anthem Full Dual Advantage 2 (HMO D-SNP) H9525-018-000,IEP,7154917710,6/22/1960,3204 BRIAN ST APT 5,EAU CLAIRE,WI,54701,ENGLISH,Active,,MM ENGLISH 3
1.58507E+11,MARTHA,MULNIX,6/30/2025,5KG8NE0KN54,KRISTOFF RAMSOOK,KRISTOFF RAMSOOK,WELLCARE,Wellcare Dual Access Open (PPO D-SNP) H2775-112-000,MOV,6076440326,6/4/1957,214 St Charles St,Johnson City,NY,13790,ENGLISH,Active,,
1.58804E+11,RAY,COBB,6/30/2025,9UA9AM6HE12,NICK GONZALES,NICK GONZALES,UNITED HEALTHCARE,AARP Medicare Advantage from UHC MS-0001 (HMO-POS) H5253-141-000,DST,6015628965,11/5/1956,10020 ROAD 1325,UNION,MS,39365,ENGLISH,Active,,MM ENGLISH 3
1.58817E+11,FLORINDA,CORREA GONZALEZ,6/30/2025,3JD4RK9HK79,JAVIER VALENCIA,JAVIER VALENCIA,UNITED HEALTHCARE,AARP Medicare Advantage Giveback from UHC TX-38 (HMO-POS) H4527-051-000,DST,8303080407,7/15/1954,308 W 6TH ST,DEL RIO,TX,78840,SPANISH,Active,,NOT FOUND
1.58817E+11,VICENTE,MADERA,6/30/2025,3GH2RM7WE98,LOUIS MARQUEZ,LOUIS MARQUEZ,UNITED HEALTHCARE,AARP Medicare Advantage Giveback from UHC AZ-9 (PPO) H2406-064-000,DST,6024180604,12/23/1953,9308 W HEBER RD,TOLLESON,AZ,85352,ENGLISH,Active,,MM LONGFORM 2
1.58819E+11,Gladstone,Mcfarlane,6/30/2025,9qu1uh9fp25,GEORGE GUENTHER,GEORGE GUENTHER,UNITED HEALTHCARE,UHC Dual Complete NY-S001 (PPO D-SNP) H2001-063-002,MCD,3474211864,10/6/1959,"1594 E 52ND ST, BROOKLYN, KINGS, NY 11234",Union,NY,11234,ENGLISH,Active,,PX Upload May 2025
1.58763E+11,FRANK,GONZALEZ,6/30/2025,7VP6G58HR43,BILLY HODGE,BILLY HODGE,UNITED HEALTHCARE,UHC Dual Complete NY-S002 (HMO-POS D-SNP) H3387-014-001,INT,3159403409,10/7/1963,1801 erie blvd east,syracuse,NY,13210,ENGLISH,Active,,MOXXIEU65
1.58803E+11,Maria,Marshall,6/30/2025,6Y38XG2YM41,ADRIANA ARROYAVE,ADRIANA ARROYAVE,AETNA,Aetna Medicare Value Select (HMO) H3312-074-000,DST,9177745186,8/28/1957,349 BEACH 57TH ST APT 3D,Arverne,NY,11691,ENGLISH,Active,,MOXXIEO65
1.58803E+11,PHILIP,ORLANDO,6/30/2025,1D63GJ3GR90,ADAM SCOGGINS,ADAM SCOGGINS,WELLCARE,Wellcare Dual Access (HMO-POS D-SNP) H6550-004-000,MCD,3162545477,5/30/1969,1909 S ANNA ST LOT 4,WICHITA,KS,67209,ENGLISH,Active,,MOXXIEU65
1.58817E+11,Robert,Kohler,6/30/2025,4X39HQ9NY51,OSCAR VALIDO,OSCAR VALIDO,UNITED HEALTHCARE,AARP Medicare Advantage from UHC CA-023P (HMO-POS) H0543-222-000,MCD,9164205780,9/12/1952,"3350 AUBURN BLVD SPC 22, SACRAMENTO, SACRAMENTO, CA 95821",sacramento,CA,95821,ENGLISH,Active,,NOT FOUND
1.58796E+11,ALEJANDRO,MORALES,6/30/2025,2MX4Y86JV73,TERENCE PHILLIPS,TERENCE PHILLIPS,HUMANA,Humana Full Access H5216-287 (PPO) H5216-287-000,DST,3138547832,4/11/1956,10017 ALLEN POINTE DR,ALLEN PARK,MI,48101,ENGLISH,Active,,
1.58771E+11,gordon,smith,6/30/2025,4DH3C67AP86,JEREMY RAMOS,JEREMY RAMOS,HUMANA,Humana Gold Plus - Diabetes and Heart (HMO C-SNP) H5619-161-000,CSNP,8439418064,7/18/1952,28 Bay Breeze Ln,beaufort,SC,29905,ENGLISH,Active,,NOT FOUND
1.58795E+11,Betty,Williams,6/30/2025,1GF2ET8GE16,GEORGE GUENTHER,GEORGE GUENTHER,WELLCARE,Wellcare Dual Access (HMO-POS D-SNP) H1416-035-000,MCD,7316147546,4/13/1960,"61 TRIPLE D LN APT B, LEXINGTON, HENDERSON, TN 38351",LEXINGTON,TN,38351,ENGLISH,Active,,HappyQuote
1.58789E+11,JUAN,LEIVA,6/30/2025,4dg0ay4cr27,BENNY BENJARARA,BENNY BENJARARA,UNITED HEALTHCARE,UHC Dual Complete IN-S3 (PPO D-SNP) H2001-067-000,MCD,4632488489,12/17/1943,3728 ROBSON ST,INDIANAPOLIS,IN,46201,SPANISH,Active,,HappyQuote
1.5879E+11,Russell,Calvin,6/30/2025,4W48AR1MT27,RICHARD REY,RICHARD REY,HUMANA,HumanaChoice Giveback H5216-308 (PPO) H5216-308-000,SNP,9103574333,7/23/1956,3126 Irvington St,Richmond,VA,23234,ENGLISH,Active,,MOXXIEO65
1.5879E+11,Vernell,Clay JR,6/30/2025,3ER8EH8KU66,JOHN STAMPOLIS,INIKIA RAWLINSON,CIGNA,Cigna Preferred Savings Medicare (HMO) H4513-083-004,MCD,2107698947,9/20/1956,6639 monterey st,San Antonio,TX,78227,ENGLISH,Active,,MOXXIEO65
1.58769E+11,Eleni,Paximadakis,6/30/2025,8AN1P27YM90,JON GONZALES,JON GONZALES,UNITED HEALTHCARE,UHC Dual Complete NY-S002 (HMO-POS D-SNP) H3387-014-001,MCD,8455878680,11/3/1959,48 BERKELEY CIR,Suffern,NY,10901,ENGLISH,Active,,HOTMED AGED 5/20
1.58766E+11,VICTOR,BUSTAMANTE,6/30/2025,6RU4TQ0RQ86,LOUIS MARQUEZ,LOUIS MARQUEZ,HUMANA,HumanaChoice Giveback H5216-350 (PPO) H5216-350-000,MOV,9152226248,4/27/1952,12985 Bucknell Dr,EL PASO,TX,79906,SPANISH,Active,,
1.58766E+11,WILLIAM,CHANDLER JR.,6/30/2025,9VQ5HE2TN61,RAQUEL MCCRAY,RAQUEL MCCRAY,HUMANA,HumanaChoice Giveback H5216-345 (PPO) H5216-345-000,DST,8033722237,8/8/1953,1111springdale rd apt 107,rock hill,SC,29730,ENGLISH,Active,,MOXXIEO65
1.58786E+11,Mary,Bigelow,6/30/2025,5MQ8W39UA41,ANDRE AMORIM,ANDRE AMORIM,HUMANA,Humana Gold Plus SNP-DE H3533-002 (HMO D-SNP),MCD,7167851294,1/25/1959,"3711 LAKE SHORE DR E LOT 79, DUNKIRK,","3711 LAKE SHORE DR E LOT 79, DUNKIRK,",NY,14048,ENGLISH,Active,,
1.58786E+11,JOHN,HEMBY,6/30/2025,5JJ1QY6PY05,BETHANY RAMIREZ,BETHANY RAMIREZ,UNITED HEALTHCARE,UHC Dual Complete NY-S002 (HMO-POS D-SNP) H3387-014-002,INT,9293619808,12/18/1956,305 E 165TH ST APT 2G,BRONX,NY,10456,ENGLISH,Active,,MOXXIEO65
1.58761E+11,CHARLOTTE,JACQUES,6/30/2025,8XD1A13HU36,TERENCE PHILLIPS,TERENCE PHILLIPS,UNITED HEALTHCARE,Peoples Health Complete Care LA-5 (HMO-POS C-SNP) H1961-022-000,DST,5048960437,7/20/1957,4516 LONELY OAK DR,NEW ORLEANS,LA,70126,ENGLISH,Active,,MOXXIEO65
1.58752E+11,Trena,coan,6/30/2025,5YY5W44NN60,JEREMY RAMOS,JEREMY RAMOS,UNITED HEALTHCARE,UHC Dual Complete OH-S3 (HMO-POS D-SNP) H1285-002-000,MCD,4404129084,10/4/1960,43 HAWTHORNE ST APT 1,elyria,OH,44034,ENGLISH,Active,,PX JUNE
1.58756E+11,ERIC,REBMAN,6/30/2025,2mw1a51gv32,BENNY BENJARARA,BENNY BENJARARA,HUMANA,HumanaChoice - Diabetes and Heart (PPO C-SNP) H5216-375-000,CSNP,2319239963,10/6/1958,8331 W WHIPPERWILL LN,MEARS,MI,49434,ENGLISH,Active,,PX JUNE
1.58786E+11,ricky,waterman,6/30/2025,9FV8N86EE50,GEORGE GUENTHER,GEORGE GUENTHER,ANTHEM,Anthem HealthPlus Full Dual Advantage (HMO D-SNP) - H8432-042-000,MCD,9175096303,4/30/1960,57e 129 th st apt 1b,manhattan,NY,10035,ENGLISH,Active,,MOXXIEO65
1.58506E+11,laura,pittman,6/30/2025,9CF1H54UJ39,BILLY HODGE,BILLY HODGE,HUMANA,Humana Gold Plus Giveback H1036-269 (HMO) H1036-269-000,DST,4077612664,8/16/1958,355 SILVER SPRINGS DR,OVIEDO,FL,32765,ENGLISH,Active,,MOXXIEO65
1.58752E+11,Eddie,Alford,6/30/2025,2CJ1C32DC37,ADAM RODRIGUES,ADAM RODRIGUES,HUMANA,Humana USAA Honor Giveback (PPO) H5216-286,DST,4782933993,9/5/1955,538 Cuyler st / PO BOX 922,Oglethorpe,GA,31067,ENGLISH,Active,,MOXXIEO65
1.58759E+11,DAVID,DUFRESNE,6/30/2025,9Q94FT3FW05,KRISTOFF RAMSOOK,KRISTOFF RAMSOOK,HUMANA,Humana Full Access Giveback H5216-306 (PPO) H5216-306-000,DST,9893872241,12/7/1959,4818 YUCCA ST,HOUGHTON LAKE,MI,48629,ENGLISH,Active,,PX Upload May 2025
1.58759E+11,Victor,Wilson,6/30/2025,4KH7A46WK73,ARMAND SEGU,ARMAND SEGU,UNITED HEALTHCARE,UHC Dual Complete FL-Y5 (HMO-POS D-SNP),IEP,8632801742,5/30/1960,1301 VALENCIA AVE,HAINES CITY,FL,33844,ENGLISH,Active,,NOT FOUND
1.57878E+11,ELIDA,HERNANDEZ,6/28/2025,9QP8Q20WM58,TERENCE PHILLIPS,TERENCE PHILLIPS,UNITED HEALTHCARE,UHC Dual Complete MI-V001 (HMO-POS D-SNP) H2247-003-000,MCD,9202405481,7/19/1954,1916 S PARK ST,KALAMAZOO,MI,49001,ENGLISH,Active,,PX Upload May 2025
1.57842E+11,sylvia,patrick,6/28/2025,1VK5C19GP40,JEREMY RAMOS,JEREMY RAMOS,HUMANA,Humana Gold Plus SNP-DE H6622-087 (HMO D-SNP) H6622-087-000,MCD,3302831956,9/2/1957,46 W BARTGES ST,akron,OH,44310,ENGLISH,Active,,NOT FOUND
1.57862E+11,Jane,Mcintyre,6/28/2025,5NH7VU3GN74,ASHLEY FRAZIER,ASHLEY FRAZIER,AETNA,Aetna Medicare Premier Plus (PPO) H5521-319-000,DST,8645413495,8/25/1950,127 EASLER WEBB LN,COWPENS,SC,29330,ENGLISH,Active,,PX JUNE
1.5786E+11,ORLANTHA,PEARSON,6/28/2025,2U84DM0XJ64,TERENCE PHILLIPS,TERENCE PHILLIPS,UNITED HEALTHCARE,UHC Dual Complete MO-S3 (HMO-POS D-SNP) H0169-009-000,DST,3142013203,2/27/1979,9104 HUISKAMP AVE,JENNINGS,MO,63136,ENGLISH,Active,,PX Upload May 2025
1.57835E+11,Edward,Mcintyre,6/28/2025,1WE8PF7WF46,ASHLEY FRAZIER,ASHLEY FRAZIER,AETNA,Aetna Medicare Premier Plus (PPO) H5521-319-000,DST,8645413495,10/11/1957,127 EASLER WEBB LN,COWPENS,SC,29330,ENGLISH,Active,,PX JUNE
1.57835E+11,charelle,hanley,6/28/2025,9PP1F65VV16,JEREMY RAMOS,JEREMY RAMOS,UNITED HEALTHCARE,AARP Medicare Advantage from UHC NJ-0004 (PPO) H8768-022-000,CDC,2012219588,12/25/1953,34 STATE ST APT 3H,teaneck,NJ,7666,ENGLISH,Active,,PX Upload May 2025
1.57819E+11,SAMUEL,SILGUERO JR,6/28/2025,8QC5AG4NQ72,OSCAR VALIDO,OSCAR VALIDO,UNITED HEALTHCARE,UHC Complete Care TX-19 (HMO-POS C-SNP) H4527-042-000,CSNP,9567307747,11/24/1953,"12486 W TIO CANO RD, LA FERIA, CAMERON, TX 78559",cameron,TX,78559,ENGLISH,Active,,NOT FOUND
1.57833E+11,Stella,Baker,6/28/2025,8VW0MC0ND18,GEORGE GUENTHER,GEORGE GUENTHER,HUMANA,HumanaChoice R0110-016 (Regional PPO) R0110-016-000,NLS,5135440022,10/15/1962,"1711 1ST AVE, CINCINNATI, HAMILTON, OH 45251",CINCINNATI,OH,45204,ENGLISH,Active,,PX Upload May 2025
1.5783E+11,Vickie,Franklin,6/28/2025,5ej7x83gd40,BENNY BENJARARA,BENNY BENJARARA,HUMANA,HumanaChoice Giveback H5216-371 (PPO) H5216-371-000,DST,4809387546,11/26/1959,226 E Jessie Owens Pkwy,PHOENIX,AZ,85041,ENGLISH,,,MM ENGLISH 3
1.57391E+11,Jenie,Carter,6/28/2025,4j19d13yr43,OSCAR VALIDO,OSCAR VALIDO,UNITED HEALTHCARE,UHC Dual Complete OK-V001 (HMO-POS D-SNP),MOV,9189022674,5/26/1961,"5354 S 36TH WEST AVE, TULSA, TULSA, OK 74107",tulsa,OK,74107,ENGLISH,Active,,PX Upload May 2025
1.57801E+11,dawn,kerr,6/28/2025,9F53NN8TY73,JEREMY RAMOS,JEREMY RAMOS,UNITED HEALTHCARE,UHC Dual Complete SC-S2 (PPO D-SNP) H2001-075-000,MCD,6098054192,9/21/1967,336 rowdy cir,seneca,SC,29677,ENGLISH,,,PX Upload May 2025
1.57803E+11,ELENA,HELGOTH,6/28/2025,8QG0HF9XV39,SABRINA GONZALES,SABRINA GONZALES,HUMANA,HumanaChoice H5525-084 (PPO),MCD,9255651750,10/14/1952,807 PRARIE ROSE WAY,BRENTWOOD,CA,94513,ENGLISH,Active,,PX JUNE 4 of 5
1.57793E+11,ricky,Wiggins,6/28/2025,4DU9Y97VK42,BENNY BENJARARA,BENNY BENJARARA,HUMANA,Humana Gold Plus - Diabetes and Heart (HMO C-SNP) H6622-071,DST,4053239256,1/27/1963,7815 108TH AVE NE,NORMAN,OK,73026,ENGLISH,Active,,PX JUNE 5 of 5
1.57797E+11,SHERYL,SCHWARTZ,6/28/2025,8YP9YQ1NX30,CRISTINA RODRIGUEZ,CRISTINA RODRIGUEZ,UNITED HEALTHCARE,UHC Dual Complete MI-V001 (HMO-POS D-SNP) H2247-003-000,MCD,6162847209,2/23/1957,114 BROOKMEADOW CT SW APT 12,GRANDVILLE,MI,49418,ENGLISH,Active,,MOXXIEO65
1.57769E+11,jeff,richey,6/28/2025,9ER1U84YU27,JAMES MEYER,JAMES MEYER,UNITED HEALTHCARE,UHC Dual Complete UT-V001 (PPO D-SNP),MCD,3857075364,5/8/1961,"7966 so Main Street, MIDVALE, SALT LAKE, UT 84047",midvale,UT,84047,ENGLISH,Active,,PX JUNE
1.57786E+11,Denise,Jackson,6/28/2025,8WD1W59JG06,STEVEN TORRES,SARAH SANZ,UNITED HEALTHCARE,UHC Dual Choice DC-Y2 (PPO D-SNP) H2406-053-000,MCD,3013886011,3/6/1960,3533 18th st se,Washington,WA,20020,ENGLISH,Active,,HOTMED AGED 5/20
1.57783E+11,derek,mcknight,6/28/2025,9C49C83FH19,JEREMY RAMOS,JEREMY RAMOS,UNITED HEALTHCARE,UHC Dual Complete PA-S002 (HMO-POS D-SNP) H3113-009-000,MCD,2675846002,10/18/1957,2717 W LEHIGH AVE,philadelphia,PA,19132,ENGLISH,Active,,MOXXIEO65
1.57768E+11,aida,hart,6/28/2025,8GR0V36KX29,GEORGE GUENTHER,GEORGE GUENTHER,ANTHEM,Anthem HealthPlus Full Dual Advantage (HMO D-SNP) H8432-042-000,MCD,3473208806,3/21/1964,370e 23rd st apt o,brooklyn,NY,11225,ENGLISH,Active,,MOXXIEU65
1.57786E+11,MAMIE,BRAY,6/28/2025,9VG9RR2AT47,ADAM SCOGGINS,ADAM SCOGGINS,AETNA,Aetna Medicare Freedom (PPO) H5521-222-000,MOV,9542976159,6/25/1950,309 7TH AVE,BRUNDIDGE,AL,36010,ENGLISH,Active,,HOTMED AGED 5/20
1.57766E+11,AIMEE,IRWIN,6/28/2025,9HX2PP9PH83,TERENCE PHILLIPS,TERENCE PHILLIPS,UNITED HEALTHCARE,UHC Dual Complete PA-S3 (HMO-POS D-SNP) H3113-016-000,IEP,7243446255,10/7/1971,173 CHURCH ST APT 2,WASHINGTON,PA,15301,ENGLISH,Active,,MOXXIEU65
1.57778E+11,DORIS,STEELE,6/28/2025,3VD1D32UX10,RAQUEL MCCRAY,RAQUEL MCCRAY,HUMANA,HumanaChoice Giveback H5216-308 (PPO),NLS,7032727912,1/25/1950,"4811 GREEN DUCK LN, FAIRFAX, FAIRFAX, VA 22033",FAIRFAX,VA,22033,ENGLISH,Active,,HOTMED AGED 5/20
1.57781E+11,JAMES,FULMER,6/28/2025,1A36RU7KV50,LOUIS MARQUEZ,LOUIS MARQUEZ,AETNA,Aetna Medicare Dual Signature (HMO D-SNP) H3239-013-000,IEP,9856403071,6/9/1960,68068 HIGHWAY 41 TRLR 2,PEARL RIVER,LA,70452,ENGLISH,Active,,MOXXIEO65
1.57776E+11,CHARLES,JAMES,6/28/2025,9HW6VT9EN75,GEORGE GUENTHER,GEORGE GUENTHER,UNITED HEALTHCARE,UHC Dual Complete LA-S4 (PPO D-SNP) H1889-031-000,MCD,5043209541,9/13/1953,911 arms blvd,marrero,LA,70071,ENGLISH,Active,,MOXXIEO65
1.57776E+11,toni,holt,6/28/2025,6R83M13JQ79,JAMES MEYER,JAMES MEYER,WELLCARE,Wellcare Dual Liberty (HMO-POS D-SNP),DST,2704553324,1/6/1971,"230 MUSTANG LN, RINEYVILLE, HARDIN, KY 40162",rineyville,KY,40162,ENGLISH,Active,,MOXXIEU65
1.57755E+11,Rodney,Austin,6/28/2025,9QF2JY6UR16,AIDAN DECAMILLO,AIDAN DECAMILLO,ANTHEM,Anthem HealthPlus Full Dual Advantage (HMO D-SNP) H8432-042-000,IEP,9292207955,5/1/1960,"179 THROOP AVE, APT 408",BROOKLYN,NY,11206,ENGLISH,Active,,MOXXIEO65
1.5739E+11,CYNTHIA,HARKINS,6/28/2025,4AY1UC1QJ95,RAQUEL MCCRAY,RAQUEL MCCRAY,WELLCARE,Wellcare Giveback (HMO) H1032-195-000,DST,9543587808,4/1/1957,"11469 NW 42ND ST, CORAL SPRINGS, BROWARD, FL 33065",BROWARD,FL,33065,ENGLISH,Active,,MOXXIEO65
1.57725E+11,agnes,tooni,6/28/2025,1R81GT5KG11,JAMES MEYER,JAMES MEYER,HUMANA,HumanaChoice SNP-DE H5525-036 (PPO D-SNP),DST,8287362260,9/24/1960,"755 WRIGHTS CREEK RD, CHEROKEE, CHEROKEE, NC 28719",cherokee,NC,28696,ENGLISH,Active,,MOXXIEU65
1.575E+11,PEDRO,ALDAY,6/27/2025,6UE3X62EH08,NATHALY COGLE,INIKIA RAWLINSON,CIGNA,Cigna Preferred Full Savings Medicare (HMO) H4513-091-000,DST,9362121973,11/28/1949,1399 SM TUCKER RD,pollok,TX,75969,SPANISH,Active,,
1.57519E+11,Tony,Clemons,6/27/2025,4YP7VM9NC41,TAYLOR DUNCAN,TAYLOR DUNCAN,UNITED HEALTHCARE,UHC Dual Complete TN-S001 (HMO-POS D-SNP),MCD,9313495271,3/29/1961,4210 RICKMAN RD LOT O15,Cookeville,TN,38506,ENGLISH,Active,,MOXXIEU65
1.575E+11,MARSHA,MOLINE,6/27/2025,6K97RQ3VN50,ADAM SCOGGINS,ADAM SCOGGINS,UNITED HEALTHCARE,UHC Dual Complete WA-S4 (HMO-POS D-SNP) H5008-020-000,MOV,4253089053,4/26/1954,"10124 9th Ave W, E117",EASTMONT,WA,98204,ENGLISH,Active,,MOXXIEO65
