Record ID,First Name,Last Name,DATE,MBI NUMBER,CLOSER,ENROLLER,CARRIER,FULL PLAN NAME & CODE,SEP,Mobile Phone Number,Date of birth,Street Address,City,STATE,Postal Code,LANGUAGE,STATUS,Status,LEAD SOURCE
1.35397E+11,Alvaro,Sandi,5/31/2025,3YP6V08EU55,BETHANY RAMIREZ,BETHANY RAMIREZ,AETNA,Aetna Medicare Assure (HMO D-SNP) H3312-069-000,MCD,9174705836,1/12/1956,525 RIVERLEIGH AVE UNIT 36,Riverhead,NY,11901,ENGLISH,No Carrier Match,,MG_REAL_TIME
1.35523E+11,ronald,white,5/31/2025,2FQ4JP4QN91,YARISSA FERNANDEZ,YARISSA FERNANDEZ,UNITED HEALTHCARE,UHC Complete Care PA-17 (HMO-POS C-SNP) H5253-192-000,CSNP,4847644782,5/22/1963,4966 HAMILTON BLVD APT 1,"ALLENTOWN, LEHIGH",PA,18106,ENGLISH,Unknown,,PX Upload May 2025
1.35227E+11,Sherry,Alkhatib,5/31/2025,7DP1F64JR93,OLGA GRAJALES,OLGA GRAJALES,UNITED HEALTHCARE,Plan:UHC Dual Complete IN-D001 (PPO D-SNP),MCD,3174188775,6/2/1957,1206 PAUL DR,INDIANAPOLIS,IN,46229,ENGLISH,Unknown,,PX Upload May 2025
1.35204E+11,MANUEL,"LOPEZ, III",5/30/2025,5NE4C22RN62,TERENCE PHILLIPS,TERENCE PHILLIPS,HUMANA,Humana Gold Plus Giveback H5619-150 (HMO),IEP,8057935653,3/30/1983,8257 SUNSTONE ST,VENTURA,CA,93004,ENGLISH,Active,,PX JUNE
1.35295E+11,Michelle,Abdelaziz,5/30/2025,6PA9YD1NP59,ADAM RODRIGUES,ADAM RODRIGUES,HUMANA,Humana Gold Plus SNP-DE H8908-005 (HMO D-SNP),MCD,2482199879,9/25/1966,18621,Detroit,MI,48235,ENGLISH,Active,,PX Upload May 2025
1.35323E+11,RICKY,COGSWELL,5/30/2025,1YD2R02YA81,TERENCE PHILLIPS,TERENCE PHILLIPS,WELLPOINT,Wellpoint Full Dual Advantage (HMO D-SNP) H8849-010-001,MOV,9362809499,11/5/1958,"110 Champion Drive, Apt. 821",Lufkin,TX,75901,ENGLISH,No Carrier Match,,PX Upload May 2025
1.35204E+11,rosemary,capuchin,5/30/2025,4NY5CQ7TF72,GEORGE GUENTHER,GEORGE GUENTHER,ANTHEM,Anthem Full Dual Advantage Aligned (HMO D-SNP),INT,5597229487,12/9/1959,5185 w mission avenu,fresno,CA,93721,ENGLISH,Active,,MOXXIEO65
1.35277E+11,Keith,Duncan,5/30/2025,8y62yw3wf19,JACLYN LAVERY,JACLYN LAVERY,UNITED HEALTHCARE,AARP® Medicare Advantage from UHC AZ-002P (HMO-POS) H0609-027-000,DST,4809253404,4/28/1955,419  E  Washington Ave unit D,gilbert,AZ,85234,ENGLISH,Unknown,,PX Upload May 2025
1.35196E+11,DAVID A,SCHUPP,5/30/2025,5P71H88DH22,LAUREN WILLIAMS,KIMBERLY BUCHANAN,ANTHEM,Anthem Full Dual Advantage Aligned (HMO D-SNP) H4471-001,DST,6614338122,9/19/1959,40701 RANCHO VISTA BLVD SPC 167,PALMDALE,CA,93551,ENGLISH,Active,,DNC UPLOAD FOR DUPES
1.35174E+11,Frank,Snyder,5/30/2025,7mp9ww0hd12,BENNY BENJARARA,BENNY BENJARARA,AETNA,Aetna Medicare Value (PPO) H5521-260-000,DST,2702130380,9/11/1973,216 CLARK ST,PROVIDENCE,KY,42450,ENGLISH,No Carrier Match,,PX Upload May 2025
1.35242E+11,Rosa,Miranda,5/30/2025,6TN2JP1KT12,TERENCE PHILLIPS,TERENCE PHILLIPS,HUMANA,HumanaChoice Giveback H5216-358 (PPO) H5216-358-000,DST,3472618698,6/19/1958,7607 SHELLMONT CT,CYPRESS,TX,77433,ENGLISH,Active,,PX Upload May 2025
1.35192E+11,Sandria,Mosley,5/30/2025,7RU7D62VU39,ADAM RODRIGUES,ADAM RODRIGUES,HUMANA,Humana Gold Plus Giveback H1036-265 (HMO),ICEP,7273099393,2/12/1960,2014 East North Bay,Tampa,FL,33610,ENGLISH,Active,,PX Upload May 2025
1.35253E+11,MARTHA,EDWARDS,5/30/2025,4FP2C03DQ21,BILLY HODGE,BILLY HODGE,UNITED HEALTHCARE,AARP Medicare Advantage Giveback from UHC TX-31 (PPO) H1278-021-000,SNP,7025816730,2/13/1954,500 PECAN ESTATES RD,ANGLETON,TX,77515,ENGLISH,Unknown,,MG_REAL_TIME
1.3523E+11,Wilburt,Smith,5/30/2025,3HG4VR2AN93,GEORGE GUENTHER,GEORGE GUENTHER,HUMANA,HumanaChoice H5216-266 (PPO),MOV,7574056091,3/1/1951,"19 KIRBY ST, PORTSMOUTH,",PORTSMOUTH,VA,23702,ENGLISH,Active,,PX Upload May 2025
1.35242E+11,ROSCOE,BROWN JR,5/30/2025,5eh1xm4md37,BENNY BENJARARA,BENNY BENJARARA,HUMANA,Humana Gold Plus Integrated SNP-DE H5619-054 (HMO-POS D-SNP) H5619-054-000,INT,3178326814,7/8/1957,"530 N HOLMES AVE, APT 308",INDIANAPOLIS,IN,46222,ENGLISH,Cancelled,,HOTMEDO65
1.35201E+11,DORMETTER D,PAIGE,5/30/2025,8DH0J43HK33,ARTEMISA CARVALHO,KIMBERLY BUCHANAN,UNITED HEALTHCARE,AARP MEDICARE ADVANTAGE FROM UHC CA-0036 PPO H0294-044,DST,5595583682,5/9/1951,3300 GOSFORD RD APT A5,Bakersfield,CA,93309,ENGLISH,Unknown,,PX Upload May 2025
1.35229E+11,James,Sharp,5/30/2025,2WH6D01FJ62,JEREMY MONELL,INIKIA RAWLINSON,WELLCARE,Wellcare Simple (HMO-POS) H1416-077-000,NLS,4232237270,11/30/1971,857 Briceville Hwy,Rocky Top,TN,37769,ENGLISH,Unknown,,DNC UPLOAD FOR DUPES
1.3522E+11,William,Quinn Sr,5/30/2025,6WG7CE1GA54,ADRIANA ARROYAVE,ADRIANA ARROYAVE,UNITED HEALTHCARE,AARP Medicare Advantage Patriot No Rx TC-MA01 (HMO-POS),DST,9012926537,3/19/1967,4526 HUGHES MEADOW DR,MEMPHIS,TN,38125,ENGLISH,Unknown,,
1.35197E+11,Alice,Eason,5/30/2025,2YY0P08FW25,JACLYN LAVERY,JACLYN LAVERY,HUMANA,Humana Gold Plus Giveback H4141-022 (HMO),SNP,7068773979,10/14/1959,122 Blake Dr,augusta,GA,30909,ENGLISH,Active,,PX Upload May 2025
1.35192E+11,Teri,Fairbanks,5/30/2025,7T78V65ED57,KRISTOFF RAMSOOK,SARAH SANZ,UNITED HEALTHCARE,UHC Dual Complete WI-D002 (HMO-POS D-SNP),DST,9207706560,11/30/1965,711 Juneau St,Kewaunee,WI,54216,ENGLISH,Unknown,,DNC UPLOAD FOR DUPES
1.35186E+11,Leila,Souza,5/30/2025,1w65ka8tk53,CARL CAMPBELL,CARL CAMPBELL,HUMANA,Humana Gold Plus - Diabetes and Heart (HMO C-SNP) H1036-299,CSNP,8135287381,5/14/1957,8808 Oak Circle,tampa,FL,33615,ENGLISH,Active,,
1.35222E+11,MELINDA,COULTER,5/30/2025,9XA4Y71QY80,PAOLA ALMANAZAR,PHIL COOK,HUMANA,Humana Gold Plus H5619-021,DST,9497507584,11/10/1952,30 VIA AMISTOSA APT B,RANCHO SANTA MARGARITA (RSM),CA,92688,ENGLISH,Active,,DNC UPLOAD FOR DUPES
1.35163E+11,DEBRA,ADAMS,5/30/2025,5M30Q65PH08,ARMANIE GREGOIRE,ARMANIE GREGOIRE,HUMANA,Humana USAA Honor Giveback with Rx (PPO) H5216-351-000,DST,9792530352,1/14/1956,315 N Morgan St,ANGLETON,TX,77515,ENGLISH,Active,,PX JUNE
1.35204E+11,JACQUELINE L,JONES,5/30/2025,3WF3YR4MG18,LAUREN WILLIAMS,KIMBERLY BUCHANAN,HUMANA,Humana Community HMO Diabetes and Heart (HMO C-SNP) H1468- 017,MOV,5867388362,11/22/1961,6346 s champlain ave apt 1,Chicago,IL,60637,ENGLISH,Active,,DNC UPLOAD FOR DUPES
1.35172E+11,JOANN,MARTIN,5/30/2025,3FG9RG2ET00,TERENCE PHILLIPS,TERENCE PHILLIPS,HUMANA,HumanaChoice - Diabetes and Heart (PPO C-SNP) H5216-375-000,CSNP,2488771154,9/16/1948,4044 CAMBROOK LN,WATERFORD,MI,48329,ENGLISH,Active,,MM SPANISH 2
1.35077E+11,RAISA,LOPEZ,5/30/2025,3ND3CY2RQ02,LOUIS MARQUEZ,LOUIS MARQUEZ,UNITED HEALTHCARE,UHC Dual Complete FL-Y5 (HMO-POS D-SNP) H2509-003-000,MCD,4078664116,8/26/1954,2713 PINE BRANCH DR,ORLANDO,FL,32822,SPANISH,Cancelled,,MM SPANISH 2
1.35093E+11,Donna,Warwick,5/30/2025,6HX5TG8UC58,LAURA DREMEL,JAMIE GINBERG,WELLPOINT,Wellpoint Full Dual Advantage,INT,8563832395,5/22/1954,508 Morris St,Gloucester,NJ,8030,ENGLISH,,,MOXXIEO65
1.3516E+11,Kathleen,Hirst,5/30/2025,4AJ5UV9MQ40,ADAM RODRIGUES,ADAM RODRIGUES,UNITED HEALTHCARE,UHC Complete Care NY-30 (HMO-POS C-SNP) H3379-053,CSNP,8504261790,8/30/1946,235 Hamilton Ave,Olean,NY,14760,ENGLISH,Unknown,,PX JUNE
1.35098E+11,Audry,Rivera,5/30/2025,4PC0FM8YK28,GEORGE GUENTHER,INIKIA RAWLINSON,CIGNA,cigna Preferred Savings Medicare (HMO) H4513-083-001,DST,4099446768,8/26/1944,2214 18 th. Ave. North,Texas City,TX,77590,ENGLISH,Active,,MM SPANISH 2
1.35073E+11,Larry,Peters,5/30/2025,3AP8F68NR63,OLGA GRAJALES,OLGA GRAJALES,UNITED HEALTHCARE,AARP Medicare Advantage Essentials from UHC TX-21 (HMO-POS),DST,8308321741,11/7/1955,4752 FM482UNIT 367,NEW BRAUNFELS,TX,78132,ENGLISH,Unknown,,MOXXIEO65
1.3509E+11,eric,truelson,5/30/2025,3q13ht5hx78,BENNY BENJARARA,BENNY BENJARARA,WELLCARE,Wellcare TexanPlus Classic Simple (HMO-POS) H4506-003-000,SNP,9793860047,6/16/1969,"404 GLENN DR, APT B",BRENHAM,TX,77832,ENGLISH,Cancelled,,MOXXIEU65
1.35077E+11,racheal,cue,5/30/2025,8MG3M89VA13,JAMES MEYER,JAMES MEYER,HUMANA,Humana USAA Honor Giveback with Rx (PPO),DST,5317771989,10/5/1979,120 meadow lane,gretna,NE,68028,ENGLISH,Active,,PX JUNE
1.35114E+11,lionel,hampton,5/30/2025,7wk6km2mc78,JACLYN LAVERY,JACLYN LAVERY,HUMANA,Humana Dual Select H1951-056 (HMO D-SNP),MCD,5044214010,8/26/1958,4433 skyview dr,new orleans,LA,70126,ENGLISH,Active,,PX Upload May 2025
1.35094E+11,SHERYL,WILSON,5/30/2025,6M21H63WR04,MARIA PIANTANIDA,MARIA PIANTANIDA,UNITED HEALTHCARE,AARP Medicare Advantage from UHC TX-0015 (HMO-POS) H4527-037-000,DST,4093657189,8/21/1959,816 18TH ST,PORT ARTHUR,TX,77640,ENGLISH,Unknown,,MOXXIEO65
1.35093E+11,DENISE,MORELL,5/30/2025,4JE6GK0EG77,KRISTOFF RAMSOOK,KRISTOFF RAMSOOK,UNITED HEALTHCARE,UHC Dual Complete OK-S002 (HMO-POS D-SNP) H5322-031-000,DST,9184577419,4/23/1955,1700 HENSLEY DR,TAHLEQUAH,OK,74464,ENGLISH,Unknown,,
1.35075E+11,Diana,Aguilar,5/30/2025,5WT1P18WR16,ADAM RODRIGUES,ADAM RODRIGUES,HUMANA,Humana Gold Plus SNP-DE H0028-007 (HMO D-SNP) H0028-007,DST,4027101518,10/31/1968,215 North Lincoln Ave APT 102,York,NE,68467,ENGLISH,Active,,MOXXIEU65
1.35119E+11,Dorene,Woods,5/30/2025,3VN0R70VG34,ASHLEY FRAZIER,ASHLEY FRAZIER,HUMANA,Humana Gold Plus SNP-DE H3533-002 (HMO D-SNP) H3533-002-000 Humana,MCD,7165636087,10/5/1958,105 Hubbell Ave,Buffalo,NY,14220,ENGLISH,Active,,MOXXIEO65
1.35084E+11,GLORIA,HART,5/30/2025,3UC1QJ8FM19,BILLY HODGE,BILLY HODGE,HUMANA,Humana Gold Plus Giveback H5619-169 (HMO) H5619-169-000,DST,8034062597,2/19/1960,6 HOYT ST,SUMTER,SC,29150,ENGLISH,Active,,MOXXIEO65
1.35084E+11,Debbie,Hall,5/30/2025,4U40E16AQ35,TERENCE PHILLIPS,TERENCE PHILLIPS,HUMANA,HumanaChoice Giveback H5216-308 (PPO),DST,2762248702,3/29/1959,40 WOODLYN DR,COLLINSVILLE,VA,24078,ENGLISH,Active,,PX Upload May 2025
1.35102E+11,kathleen,oleary-wood,5/30/2025,9jn6q49ua89,JACLYN LAVERY,JACLYN LAVERY,HUMANA,Humana Gold Plus H6622-083 (HMO),MOV,4342122354,5/11/1951,9452 howardville road,buckingham,VA,24562,ENGLISH,Active,,HOTMEDO65
1.35004E+11,Jacquie,Sons,5/29/2025,8HN9H98CT33,TERENCE PHILLIPS,TERENCE PHILLIPS,UNITED HEALTHCARE,UHC Dual Complete TX-D004 (HMO-POS D-SNP),MCD,3614376009,5/23/1953,927 RODRIGUEZ DR No. 38,SINTON,TX,78387,ENGLISH,Cancelled,,MOXXIEO65
1.34832E+11,diana,marrero basulto,5/29/2025,8XD5M46DW60,NATHALY COGLE,NATHALY COGLE,UNITED HEALTHCARE,uhc dual complete fl y4,DST,7868048688,12/5/1951,8771 sw 54th st,miami,FL,33165,SPANISH,Active,,MM SPANISH
1.34995E+11,valentina,murray,5/29/2025,4C82VD8GQ99,GEORGE GUENTHER,GEORGE GUENTHER,WELLCARE,Wellcare Simple Open (PPO) H2117-001-000,DST,3133782916,1/16/1960,22600 middlebelt road trailer a26,farmington,MI,48336,ENGLISH,Unknown,,MOXXIEO65
1.34986E+11,RONALD,HERNANDEZ ARROYO,5/29/2025,6JD7V22YJ40,RONALD DIAZ,RONALD DIAZ,HUMANA,Humana Gold Plus Giveback H1036-271 (HMO) H1036-271-000,NLS,8507606510,4/4/1960,3275 NEWTON DR,PENSACOLA,FL,32503,SPANISH,Active,,
1.34988E+11,MARIO,HERNANDEZ,5/29/2025,6VR1WD8YG07,JOSE RODRIGUEZ,JOSE RODRIGUEZ,UNITED HEALTHCARE,UHC Preferred Dual Complete FL-D001 (HMO D-SNP) H1045-012-000,NLS,7862584792,4/9/1960,1975 W 44th Pl apt a406,Hialeah,FL,33012,SPANISH,Cancelled,,PX JUNE
1.34834E+11,stephanie,Rowland,5/29/2025,1RU1RU3NX22,OSCAR VALIDO,OSCAR VALIDO,WELLCARE,Wellcare Dual Reserve (HMO-POS D-SNP) H9630-014-000,DST,5016486654,8/1/1963,"10221 LANEHART RD APT 5, LITTLE ROCK, PULASKI, AR 72204",Little Rock,AR,72204,ENGLISH,Unknown,,PX JUNE
1.34973E+11,George,Estrada,5/29/2025,3Y87YG8KQ59,LOUIS MARQUEZ,INIKIA RAWLINSON,CIGNA,Cigna Preferred Savings Medicare (HMO) H4513-083-004,DST,2107796357,11/29/1960,16 2E whitewing Dr,Somerset,TX,78069,ENGLISH,Unknown,,DNC UPLOAD FOR DUPES
1.34834E+11,Rebeka,Sawyer,5/29/2025,4KX8UA9VF51,COURTNEY GARBATOW,COURTNEY GARBATOW,UNITED HEALTHCARE,AARP Medicare Advantage Giveback from UHC TX-34 (PPO) H1278-024-000,DST,9015707924,1/2/1966,1325 E 94TH ST,Odessa,TX,79764,ENGLISH,Unknown,,MOXXIEU65
1.34985E+11,MICHAEL,FIGUEROA,5/29/2025,5HG7MP1RQ65,TERENCE PHILLIPS,TERENCE PHILLIPS,DEVOTED,Devoted CHOICE Pennsylvania (PPO) (H6018-007),MCD,5708771457,12/14/1964,217 S Sumner Ave,Scranton,PA,18504,ENGLISH,,,PX JUNE
1.34954E+11,TIMOTHY,OWSLEY,5/29/2025,6YK4GU9RX75,STEVEN TORRES,SARAH SANZ,UNITED HEALTHCARE,UHC Dual Complete KY-S002 (HMO-POS D-SNP),DST,6062330279,6/30/1964,271 town mountain lane,PERRY,KY,40701,ENGLISH,,,DNC UPLOAD FOR DUPES
1.34971E+11,Regina,Huckaby,5/29/2025,3CD1XN0FJ08,ADAM RODRIGUES,ADAM RODRIGUES,HUMANA,Humana USAA Honor Giveback with Rx (PPO) H5525-057,DST,3235561086,6/27/1957,1227 West 91st ST apt 3,Los Angeles,CA,90044,ENGLISH,Active,,MOXXIEO65
1.34969E+11,JAMEY,KENNAMER JOHNSON,5/29/2025,4HA9XE8EV15,STEVEN TORRES,PHIL COOK,HUMANA,Humana Gold Plus SNP-DE H4461-038  (HMO D-SNP),DST,8654567387,9/10/1976,324 DICKSON ST APT 2,KNOXVILLE,TN,37914,ENGLISH,Active,,MOXXIEU65
1.34952E+11,Connie,Summers,5/29/2025,5mk8cp4qd29,PAIGHTON PYATT,PAIGHTON PYATT,ANTHEM,Anthem Dual Advantage (PPO D-SNP) H4704-001-000,MOV,9255423426,5/16/1964,"18725 CA-108, 1A",Jamestown,CA,95327,ENGLISH,Active,,MOXXIEU65
1.34954E+11,Sonja,Galabis,5/29/2025,5RE9WW7NH20,ADAM SCOGGINS,ADAM SCOGGINS,UNITED HEALTHCARE,UHC Complete Care Support CA-8AP (HMO C-SNP) H0543-249-000,CSNP,2096233448,12/16/1947,219 E PARK ST APT 8,STOCKTON,CA,95202,ENGLISH,Unknown,,HOTMED AGED 5/20
1.34955E+11,Eulalia,Oliverios,5/29/2025,6Af7j73np44,NATHALY COGLE,NATHALY COGLE,UNITED HEALTHCARE,UHC Dual Complete FL-Y5 (HMO-POS D-SNP,INT,2393840029,12/9/1951,4495 29th ave sw,naples,FL,34116,SPANISH,Unknown,,MM SPANISH 2
1.34968E+11,Virginia,Benson,5/29/2025,8QA1YT3PT13,JON GONZALES,JON GONZALES,UNITED HEALTHCARE,UHC Dual Complete MS-S4 (HMO-POS D-SNP) H5008-017-000,MCD,6622791038,3/30/1958,8 COUNTY ROAD 165,TISHOMINGO,MS,38852,ENGLISH,Unknown,,MOXXIEO65
1.34846E+11,BARBARA,CRIDER,5/29/2025,8VT3TY7NG78,ARMANIE GREGOIRE,ARMANIE GREGOIRE,HUMANA,HumanaChoice H5216-207 (PPO),DST,7062802426,7/14/1946,594 liberty drive,dalton,GA,30721,ENGLISH,Active,,HOTMEDO65
1.34846E+11,virginia,elias,5/29/2025,1R48UR3VH39,JEREMY RAMOS,JEREMY RAMOS,HUMANA,Humana Gold Plus SNP-DE H6622-087 (HMO D-SNP),MCD,4197890425,11/7/1949,533 defiance xing,defiance,OH,43125,ENGLISH,Active,,MM SPANISH 2
1.34951E+11,CARMEN,SILVA,5/29/2025,3U53KE7DR07,BETHANY RAMIREZ,INIKIA RAWLINSON,CIGNA,CIGNA PREFERRED MEDICARE HMO H0354-001-000,DST,6027820649,8/13/1941,5328 W WINDSOR AVE,PHOENIX,AZ,85035,ENGLISH,Active,,DNC UPLOAD FOR DUPES
1.3495E+11,Pedro,Lucero,5/29/2025,4N83V31XY06,ADAM SCOGGINS,INIKIA RAWLINSON,CIGNA,Cigna Preferred Medicare (HMO)  H0672-003-000,MOV,9705908762,6/2/1955,22358 Highway 14,Ault,CO,80610,ENGLISH,Unknown,,DNC UPLOAD FOR DUPES
1.34832E+11,Kathleen,Baca,5/29/2025,5C95N39EM77,ADAM RODRIGUES,ADAM RODRIGUES,WELLCARE,Wellcare Giveback (HMO) H0351-064,DST,5053610318,6/26/1957,3513 S Senate PL,Chandler,AZ,85286,ENGLISH,Unknown,,MM SPANISH 2
1.3495E+11,norma,rodriguez,5/29/2025,8XA1FF8XY28,YARISSA FERNANDEZ,YARISSA FERNANDEZ,UNITED HEALTHCARE,AARP Medicare Advantage Essentials from UHC TX-21 (HMO-POS) H0609-050-000,DST,2107639367,1/24/1959,402 HORTENCIA AVE,"SAN ANTONIO, BEXAR",TX,78237,ENGLISH,Unknown,,MM SPANISH 2
1.34951E+11,Keith,Unruh,5/29/2025,9JX3TH3JT81,TERENCE PHILLIPS,TERENCE PHILLIPS,UNITED HEALTHCARE,UHC Rocky Mountain Medicare Advantage CO-003P (HMO-POS),MOV,9704622390,12/18/1959,310 West 1st Street,Parachute,CO,81635,ENGLISH,Cancelled,,
1.34846E+11,anita,lugo,5/29/2025,9F20V47FD23,OSCAR VALIDO,OSCAR VALIDO,UNITED HEALTHCARE,UHC Dual Complete AZ-S001 (HMO-POS D-SNP) UnitedHealthcareH0321-002-000,INT,5206121066,10/2/1949,PO box 182,pirtleville,AZ,85626,ENGLISH,Cancelled,,MM SPANISH 2
1.3495E+11,Charles,Apodaca,5/29/2025,7vt0ee2wd25,BENNY BENJARARA,INIKIA RAWLINSON,UNITED HEALTHCARE,UHC Complete Care Support NM-1A (PPO C-SNP) H2001-042-00),DST,5053618217,8/2/1947,3505 MAIN ST SE,LOS LUNAS,NM,87031,ENGLISH,Unknown,,DNC UPLOAD FOR DUPES
1.34924E+11,KEVIN,BEIRIGER,5/29/2025,3G24RK9KK79,BILLY HODGE,BILLY HODGE,HUMANA,HumanaChoice SNP-DE H5216-267 (PPO D-SNP) H5216-267-000,MOV,7198501634,4/5/1950,18625 hwy 550,montrose,CO,81401,ENGLISH,Active,,MOXXIEO65
1.34923E+11,Clinton,Helling,5/29/2025,2TR1V29AQ24,ASHLEY FRAZIER,ASHLEY FRAZIER,ANTHEM,Anthem Full Dual Advantage 2 (HMO D-SNP) H9525-018-000,MCD,6084366465,9/10/1961,401 n main st,necedah,WI,54646,ENGLISH,Active,,MOXXIEU65
1.34683E+11,KEVIN ,SUNDERLAND,5/29/2025,2NM5NV9ER61,GEORGE GUENTHER,GEORGE GUENTHER,HUMANA,Humana Gold Plus Giveback H5619-150 (HMO) H5619-150-000,DST,9099194981,3/13/1957,6260 Halsted Avenue,Rancho Cucamonga,CA,91737,ENGLISH,Active,,PX JUNE
1.3491E+11,Carolyn,Neal,5/29/2025,2J65E15KE60,JON GONZALES,JON GONZALES,UNITED HEALTHCARE,UHC Complete Care TC-0005 (HMO-POS C-SNP) H5253-193-002,DST,4236825506,10/9/1962,2404 CRUTCHFIELD ST,Chattanooga,TN,37406,ENGLISH,Cancelled,,MOXXIEU65
1.34908E+11,ELIZABETH,NAGEL-HINTZ,5/29/2025,6ET7C29RX71,TERENCE PHILLIPS,TERENCE PHILLIPS,HUMANA,Humana Gold Plus Integrated SNP-DE H5619-054 (HMO-POS D-SNP),INT,2195081741,7/28/1970,5054 N PAWNEE TRL APT 17,LAPORTE,IN,46350,ENGLISH,Cancelled,,
1.34809E+11,DAWN,MILLER,5/29/2025,4WA5GN2HJ95,BILLY HODGE,BILLY HODGE,HUMANA,HumanaChoice Giveback H5216-371 (PPO) H5216-371-000,DST,4803858971,6/12/1944,"25 W 1ST AVE, APT 419",MESA,AZ,85210,ENGLISH,Cancelled,,NOT FOUND
1.34908E+11,Josefina,perezchica,5/29/2025,7ek8t89tf61,JACLYN LAVERY,INIKIA RAWLINSON,ANTHEM,Anthem Full Dual Advantage Aligned (HMO D-SNP) H4471-001-000,MCD,5597679691,3/28/1953,900 west pleasant ave apt 8,tulare,CA,93274,ENGLISH,,,MOXXIEO65
1.34885E+11,Maxine,Mauldin,5/29/2025,1WM0HN7TF32,ASHLEY FRAZIER,ASHLEY FRAZIER,UNITED HEALTHCARE,UHC Dual Complete MI-S002 (HMO-POS D-SNP) H2247-001-000,MCD,3134549442,5/15/1970,9324 burt rd,detroit,MI,48228,ENGLISH,Unknown,,MOXXIEU65
1.34855E+11,Cathy A,Guerrero,5/29/2025,6MR1XT2XR05,NEIL GOLDBERG,KIMBERLY BUCHANAN,UNITED HEALTHCARE,AARP Medicare Advantage from UHC WI-0014 (HMO-POS) H5253-034-000,ICEP,9209570158,11/17/1957,181 3rd St,Fond Du Lac,WI,54935,ENGLISH,Unknown,,
1.34646E+11,larry,ohl,5/29/2025,8T51C26TV29,GEORGE GUENTHER,GEORGE GUENTHER,AETNA,Aetna Medicare Core (HMO-POS) H2663-062-000,MOV,3168074073,6/16/1950,2218 w walker st,wichita,KS,67208,ENGLISH,No Carrier Match,,HOTMED AGED 5/20
1.34878E+11,TERESA,HASTY,5/29/2025,2PN7ET0HX76,ELIJAH CEBALLOS,ELIJAH CEBALLOS,WELLPOINT,Wellpoint Full Dual Advantage (HMO D-SNP) H8849-010-002,DST,8178706831,11/12/1963,2344 BROWN OAKS DR #402,ARLINGTON,TX,76010,ENGLISH,Active,,PX JUNE
1.34849E+11,JOYCE,RIOS,5/29/2025,2W09M20RR12,KRISTOFF RAMSOOK,KRISTOFF RAMSOOK,UNITED HEALTHCARE,UHC Dual Complete CO-S001 (PPO D-SNP) H2001-053-000,MCD,7193148908,6/3/1960,1000 13TH ST APT 1008,GREELEY,CO,80631,ENGLISH,Unknown,,MOXXIEO65
1.34831E+11,Pamela,Gray,5/29/2025,4QT9JF4CG00,NICK GONZALES,NICK GONZALES,WELLCARE,Wellcare Simple (HMO) H5087-005-000,DST,4242832159,7/23/1955,616 N ROSE AVE,COMPTON,CA,90221,ENGLISH,Unknown,,MOXXIEO65
1.34607E+11,MARIE,MORALES,5/29/2025,3H00QA1TX27,GEORGE GUENTHER,PHIL COOK,UNITED HEALTHCARE,UHC Dual Complete CT-S2 (PPO D-SNP) H2001-066,MCD,2035459958,3/9/1954,667 GARFIELD AVE 2ND FL,BRIDGEPORT,CT,6606,ENGLISH,Unknown,,DNC UPLOAD FOR DUPES
1.34676E+11,PATRICIA,BLAIR,5/29/2025,8DQ2NR3EK19,BETHANY RAMIREZ,BETHANY RAMIREZ,UNITED HEALTHCARE,UHC DUAL COMPLETE MI-S002 (HMO-POS D-SNP),IEP,5179361327,6/6/1960,126 SHAHAN DR,JACKSON,MI,49202,ENGLISH,Cancelled,,PX JUNE
1.34635E+11,John,Stephens,5/29/2025,7VC1GM2TQ12,ADAM RODRIGUES,ADAM RODRIGUES,HUMANA,Humana Gold Plus H0028-072 (HMO),DST,8323610444,2/23/1951,2811 Troy DR,Missouri City,TX,77459,ENGLISH,Active,,HOTMEDO65
1.34817E+11,Mary,Claassen,5/29/2025,4AU3NT4NN83,KRISTOFF RAMSOOK,KRISTOFF RAMSOOK,HUMANA,HumanaChoice Giveback H5216-264 (PPO) H5216-264-000,DST,4054138974,12/22/1950,4701 E COFFEE CREEK RD TRLR 38,EDMOND,OK,73034,ENGLISH,Active,,PX JUNE
1.34811E+11,Kenneth,Young,5/29/2025,7GF1P16DA93,ADAM SCOGGINS,ADAM SCOGGINS,UNITED HEALTHCARE,UHC Dual Complete CO-S001 (PPO D-SNP) H2001-053-000,MCD,7197781200,6/1/1974,2607 RIDGEWOOD LN,PUEBLO,CO,81005,ENGLISH,Unknown,,MOXXIEU65
1.34645E+11,Demrice,Hayes,5/29/2025,9TT0KT2XG90,TERENCE PHILLIPS,TERENCE PHILLIPS,HUMANA,HumanaChoice Giveback H5525-035 (PPO) H5525-035-000,IEP,3368650228,4/29/1960,3233 RENO CT,WALKERTOWN,NC,27051,ENGLISH,Active,,MOXXIEO65
1.34607E+11,teresa,rankin,5/29/2025,1PE5EP3TE74,AMIN HUSSEIN,AMIN HUSSEIN,HUMANA,Humana Gold Plus Giveback H1036-318 (HMO-POS),DST,9802716239,5/6/1967,350 HARPER MILLER RD,CLEVELAND,NC,27013,ENGLISH,Active,,MOXXIEU65
1.34579E+11,Jerome,Pistillo,5/28/2025,3RF0W78EE26,RICHARD REY,RICHARD REY,UNITED HEALTHCARE,UHC Dual Complete NE-V001 (HMO-POS D-SNP) H0169-006-000,MCD,5312722721,10/27/1962,3006 PADDOCK RD APT 217,Omaha,NE,68124,ENGLISH,Unknown,,MOXXIEU65
1.3462E+11,Yolanda,Webb,5/28/2025,2HR8A16CP53,TERENCE PHILLIPS,TERENCE PHILLIPS,UNITED HEALTHCARE,AARP Medicare Advantage Giveback from UHC CA-20 (HMO-POS),DST,7147978682,6/13/1952,2755 W PARKSIDE LN,ANAHEIM,CA,92801,ENGLISH,Unknown,,MOXXIEO65
1.3457E+11,diana,isom,5/28/2025,1k84r86cy66,JEREMY RAMOS,JEREMY RAMOS,UNITED HEALTHCARE,UHC Dual Complete MO-S3 (HMO-POS D-SNP) H0169-009-000,MCD,5738238748,4/7/1960,703 claudell ln apt 202,columbia,MO,65200,ENGLISH,Unknown,,PX JUNE
1.34634E+11,SUSAN,HILL,5/28/2025,7K97A44RA68,JOHN STAMPOLIS,PHIL COOK,UNITED HEALTHCARE,UHC Dual Complete FL-D002  (HMO-POS D-SNP) H1045-039,INT,7277092755,2/6/1960,4442 KOHLER ST,NEW PORT RICHEY,FL,34652,ENGLISH,Cancelled,,DNC UPLOAD FOR DUPES
1.34619E+11,MICHAEL,ADKINS,5/28/2025,6Y03JY2RU84,BETHANY RAMIREZ,BETHANY RAMIREZ,UNITED HEALTHCARE,UHC Dual Complete NE-S003 (HMO-POS D-SNP) H2802-053-000,DST,4028065866,9/26/1963,1700 PARK ST APT 5,BEATRICE,NE,68310,ENGLISH,Unknown,,MOXXIEU65
1.34586E+11,Gregory,Clay,5/28/2025,8KT2PQ7AE26,ADAM RODRIGUES,ADAM RODRIGUES,UNITED HEALTHCARE,UHC Dual Complete TX-D01P (HMO-POS D-SNP) H4514-016,DST,7135607116,10/18/1964,3300 Caroline ST APT 222,Houston,TX,77003,ENGLISH,Unknown,,PX Upload May 2025
1.34566E+11,Carolyn,Levy,5/28/2025,9Q92XW7KC19,TERENCE PHILLIPS,TERENCE PHILLIPS,UNITED HEALTHCARE,Peoples Health Dual Complete LA-S5 (HMO-POS D-SNP) H1961-024-000,DST,2255025757,6/7/1961,2618 77TH AVE,BATON ROUGE,LA,70807,ENGLISH,Cancelled,,MOXXIEU65
1.34661E+11,Vernetta,Johnson,5/28/2025,9wj1n05xc17,TJ HEPBURN,SARAH SANZ,UNITED HEALTHCARE,UHC Dual Complete KS-S001 (HMO-POS D-SNP) H0169-004-000,INT,3168662794,6/21/1955,5203 20th ST N,Witchta,KS,67204,ENGLISH,Cancelled,,PX Upload May 2025
1.3457E+11,EDITE,DILLON,5/28/2025,2GX4Y78CU82,AMIN HUSSEIN,AMIN HUSSEIN,ANTHEM,Optimum Diamond Rewards (HMO C-SNP),LAW,8134367225,4/22/1950,"12604 RAIN FOREST ST,",TEMPLE TERRACE,FL,33617,ENGLISH,,,PX Upload May 2025
1.34586E+11,GAYLE,BERMAN,5/28/2025,2E05MP7KW75,CARL CAMPBELL,CARL CAMPBELL,UNITED HEALTHCARE,AARP Medicare Advantage from UHC NC-26 (HMO-POS) H5253-187-000,SNP,9102656380,6/3/1958,"1243 LAKE COLE RD, LOT 13",MIDWAY PARK,NC,28544,ENGLISH,Unknown,,
1.34619E+11,LARRAINE,DOSSAN,5/28/2025,3N07G75AA39,ARTEMISA CARVALHO,PHIL COOK,AETNA,Aetna Medicare Premier (PPO) H5521-077,MOV,6072026033,10/26/1949,5 E NILES RD,BINGHAMTON,NY,13901,ENGLISH,No Carrier Match,,DNC UPLOAD FOR DUPES
1.34587E+11,lucia,dominguez,5/28/2025,7W65XK5RJ82,NATHALY COGLE,NATHALY COGLE,HUMANA,HUMANA GOLD PLUS H5619,DST,8187999464,7/5/1956,14842 hart st,vannys,CA,91405,SPANISH,Active,,MOXXIEO65
1.34649E+11,Carmen,Martinez,5/28/2025,6PQ2N07UE14,OSCAR VALIDO,OSCAR VALIDO,UNITED HEALTHCARE,UHC Complete Care FL-14 (HMO-POS C-SNP) H1045-048-003,CSNP,3473720659,7/4/1951,"23 Peace Dr Bronson, Fl 32621",Bronson,FL,32621,ENGLISH,Active,,HOTMEDO65
1.34644E+11,CYNTHIA,CROZIER,5/28/2025,7PD0QJ6ED13,AMIN HUSSEIN,AMIN HUSSEIN,UNITED HEALTHCARE,UHC Dual Complete WA-S1 (PPO D-SNP),MCD,5099863995,4/24/1954,2240 E NORTH CRESCENT AVE APT 2002,SPOKANE,WA,99207,ENGLISH,Unknown,,HOTMEDO65
1.34604E+11,Geraldine,Carmosino,5/28/2025,9YW8RT7VR68,JON GONZALES,JON GONZALES,UNITED HEALTHCARE,AARP Medicare Advantage Giveback from UHC UT-9 (PPO) H2001-131-000,MOV,3855890326,4/29/1963,3969 S 900 E APT 26,Salt Lake City,UT,84124,ENGLISH,Unknown,,PX Upload May 2025
1.3463E+11,Barbara,Watts,5/28/2025,8NF6VT9AU68,ADAM RODRIGUES,ADAM RODRIGUES,AETNA,Aetna Medicare Premier Plus (PPO) H1608-017,LCC,6205078155,2/5/1964,110 W Vine ST,Anthony,KS,67003,ENGLISH,Active,,MOXXIEU65
1.34587E+11,FAYE,IVES,5/28/2025,1C15N06EW87,MARIA PIANTANIDA,MARIA PIANTANIDA,UNITED HEALTHCARE,UHC Dual Complete TX-D01P (HMO-POS D-SNP) H4514-016-000,MCD,8328153433,5/16/1952,24027 NOMINI HALL LN,KATY,TX,77493,ENGLISH,Unknown,,HOTMEDO65
1.34602E+11,Karen,Takerian,5/28/2025,1F69AP2HA15,TERENCE PHILLIPS,TERENCE PHILLIPS,HUMANA,Humana USAA Honor Giveback (PPO) H5525-079-000,DST,5302497883,12/17/1955,709-400 BROWNS RD,LASSEN,CA,96130,ENGLISH,Active,,MOXXIEO65
1.34569E+11,Diane,Simmons,5/28/2025,1ha3qn3yt92,PAIGHTON PYATT,INIKIA RAWLINSON,UNITED HEALTHCARE,UHC Dual Complete NY-S4 (HMO-POS D-SNP) H3387-017-000,DIF,7164981659,6/28/1979,3100 Bakerstand rd,Franklinville,NY,14737,ENGLISH,Unknown,,DNC UPLOAD FOR DUPES
1.34569E+11,irene,preciado,5/28/2025,5JN8FK9CV35,AMIN HUSSEIN,AMIN HUSSEIN,ANTHEM,Anthem Full Dual Advantage Aligned (HMO D-SNP),DST,3237754409,10/30/1957,1134 E El Dorado St,West Covina,CA,91790,ENGLISH,Active,,DNC UPLOAD FOR DUPES
1.34414E+11,marcell,gurule,5/28/2025,3P70A59FK44,YARISSA FERNANDEZ,YARISSA FERNANDEZ,UNITED HEALTHCARE,AARP Medicare Advantage Extras ValueRx UT-7 (HMO-POS) H4604-018-000,MOV,3855616479,1/28/1973,1203 N 475 E,"OGDEN, WEBER",UT,84404,ENGLISH,Unknown,,PX Upload May 2025
1.34561E+11,Linda,Lanshaw,5/28/2025,8R06013DV74,RAQUEL MCCRAY,RAQUEL MCCRAY,HUMANA,Humana Full Access Giveback H5216-393 (PPO) H5216-393-000,DST,3526500064,11/11/1952,367 AUTUMN DR,PORT ORANGE,FL,34606,ENGLISH,Active,,PX Upload May 2025
1.34536E+11,lonzer,stewart jr,5/28/2025,9n94q25xj87,LAUREN WILLIAMS,LAUREN WILLIAMS,CAREPLUS,care breeze hmo cnsp h1019-002,DST,7275646486,11/15/1962,"3394 HILLSDALE AVE, LARGO, PINELLAS, FL 33774",largo,FL,33774,ENGLISH,Cancelled,,PX Upload May 2025
1.34353E+11,Nina,Wagner,5/28/2025,3J19XY8KQ22,TERENCE PHILLIPS,TERENCE PHILLIPS,HUMANA,Humana Gold Plus Giveback H5619-146 (HMO) H5619-146-000,DST,7148606425,10/18/1954,1519 E CHAPMAN AVE APT 309,FULLERTON,CA,92831,ENGLISH,Active,,HOTMEDO65
